<-- Click Here to Go Back to the Submission Status Page,,,,,,,,
Click Here to See the Oldest Submissions -->,,,,,,,,
7/16/2021 13:14:08,v,2756216,Smiley,https://imgur.com/a/yGkthl6,Conqueror,Maze,Highest Arras Scores,WR + HAS
7/24/2021 12:25:50,x,936461,je7,https://imgur.com/a/CjsbMs7,Mega Smasher,Squads-Duos,Highest Arras Scores,Run started in active server but died at around 800k. Not sure if this will be accepted
7/24/2021 14:15:28,v,697943,Smiley,https://imgur.com/a/JFMnpSp,Auto 3,Maze,,
7/24/2021 20:26:16,v,2232727,for a few dollars more,https://imgur.com/gallery/vmwM67h,Flank Guard,Open Maze TDM,Highest Arras Scores,tank 25
7/24/2021 20:51:24,v,1108844,je7,https://imgur.com/gallery/9T9UtPS,Mega Smasher,Portal 4TDM,Highest Arras Scores,Submission for Portal 4TDM Mega Smasher wr
7/24/2021 21:02:49,v,1145372,Giggity,https://imgur.com/a/jPSXrhM,Mega-3,Open Maze TDM,,Giggity#8267 (Beat my own record)
7/24/2021 22:34:19,x,2054438,Pain痛み,https://imgur.com/a/DNfkzii,Factory,Open Maze TDM,Highest Arras Scores,Pain痛み#9372
7/25/2021 3:10:18,v,1566248,Mine,https://imgur.com/a/QXS2Hsv,Architect,Open Maze TDM,,
7/25/2021 3:45:28,v,2012082,x,https://imgur.com/jc6qnOg,Mega Smasher,4TDM,Highest Arras Scores,x#*****
7/25/2021 6:19:47,v,1955631,Soma White ღ,https://imgur.com/gallery/trmYjka,Twister,2TDM,,[♪]Soma White#4614
7/25/2021 6:34:44,v,1413332,Mine,https://imgur.com/a/51Z2Ssq,Bulwark,Open Maze TDM,,
7/25/2021 6:46:56,v,884720,Smiley,https://imgur.com/a/c0wUUgp,Auto 3,Maze,,
7/25/2021 9:56:37,v,2434205,KSK,https://imgur.com/gallery/pmt547X,Healer,Event (Legacy HAS only),Highest Arras Scores,KSK#3137
7/25/2021 11:21:54,x,2298149,Icewalk,https://discord.com/channels/366661839620407297/395646588682240020/868873478776967208,Twin,2TDM,Highest Arras Scores,Icewalk#2905 has only
7/25/2021 11:41:22,x,1093597,KSK,https://imgur.com/gallery/LyTi0Bd,Septa Trapper,Portal 4TDM,,KSK#3137
7/25/2021 13:26:25,x,6701394,Break Your Limits,https://imgur.com/gallery/UhnbPnq .,Spike,4TDM,Highest Arras Scores,big thanks to asd for the prot!
7/25/2021 14:20:42,v,2254146,Giggity,https://imgur.com/a/K5wXkrq,Constructor,4TDM,Highest Arras Scores,Giggity#8267 (HAS Only)
7/25/2021 15:44:35,x,1600000,<❂> 𝓪𝓵𝓲𝓿𝓮🌹,https://imgur.com/a/2oVXPuK,Bomber,2TDM,Secondary Record,<❂> 𝓪𝓵𝓲𝓿𝓮🌹#1628
7/25/2021 15:59:48,x,3393664,fg,https://imgur.com/gallery/bMx4dPr,Octo Tank,FFA,Highest Arras Scores,1.058.114
7/25/2021 18:39:58,v,3720253,WL9,https://cdn.discordapp.com/attachments/804848075813158944/868984614549585970/screenshot_-_2021-07-25T183418.718.png,Factory,Event (Legacy HAS only),Highest Arras Scores,Suffering...
7/25/2021 21:55:42,v,1790317,NeonLights,https://imgur.com/a/qBgPeeU,Predator,Maze,,
7/25/2021 22:18:41,v,2496222,Everests,https://imgur.com/a/eVDG8t1,Auto Overseer,2TDM,Highest Arras Scores,Everests#2155
7/26/2021 0:18:16,v,1294640,for a few dollars more,https://imgur.com/gallery/kSMWb0E,Hexa Trapper,4TDM,,first 4tdm wr (besides my 800k launcher that i pretend doesnt exist)
7/26/2021 2:43:47,v,2185178,Mine,https://imgur.com/a/PKS54YV,Banshee,Open Maze TDM,Highest Arras Scores,
7/26/2021 6:02:15,v,2184033,KR Lime Lemon,https://imgur.com/gallery/KNoCnXq,Hexa Tank,Maze,Highest Arras Scores,Lamon#1357
7/26/2021 9:28:34,x,920307,<❂> 𝓪𝓵𝓲𝓿𝓮🌹,https://imgur.com/a/Gdv7C8e,Surfer,Maze 4TDM,Secondary Record,<❂> 𝓪𝓵𝓲𝓿𝓮🌹#1628
7/26/2021 9:35:15,v,920307,<❂> 𝓪𝓵𝓲𝓿𝓮🌹,https://imgur.com/a/TKrZGYr,Surfer,Maze 4TDM,,<❂> 𝓪𝓵𝓲𝓿𝓮🌹#1628
7/26/2021 9:38:07,v,881395,amToast,https://media.discordapp.net/attachments/395646588682240020/869211718423814164/screenshot_49.png,Auto Tri-Angle,Maze 4TDM,,:(
7/26/2021 10:36:22,v,2302399,Smiley,https://imgur.com/a/rRE2FMS,Factory,Maze 4TDM,Highest Arras Scores,
7/26/2021 10:44:42,X,2420473,// jAX,https://imgur.com/a/mdRJrIr,Maleficitor,Maze 4TDM,Highest Arras Scores,"Trouble#3298 (thank you to all who helped me, and thank you smiley for not goin for me, although that wouldn't have ended well.  HAS only)"
7/26/2021 10:57:52,v,2420473,// jAX,https://imgur.com/a/em8Y0vM,Maleficitor,Maze 4TDM,Highest Arras Scores,
7/26/2021 11:12:48,v,1109902,KSK,https://imgur.com/gallery/YSHxKDB,Bomber,Maze 4TDM,,KSK#3137
7/26/2021 12:38:59,v,2133478,Thx m8,https://cdn.discordapp.com/attachments/747714118118670378/869255449248145498/screenshot_-_2021-07-26T223007.183.png,Annihilator,Maze,Highest Arras Scores,"Why did you unfriend me, Icewalk 😔"
7/26/2021 13:46:00,x,3987665,yarral,https,Builder,4TDM,Secondary Record,yarrallxxb#0031
7/26/2021 13:47:42,x,10000000,dsaddasasdsda,http,Fortress,Maze,Secondary Record,sfdsfdsfsdf3131223
7/26/2021 14:13:17,v,2026674,lou,https://imgur.com/a/2qVIXaA,Rocketeer,4TDM,Highest Arras Scores,
7/26/2021 17:05:08,v,2853925,for a few dollars more,https://imgur.com/gallery/YMGR2P7,Double Twin,Squads-Duos,Highest Arras Scores,highest nondrone score
7/26/2021 20:59:26,v,3883470,for a few dollars more,https://imgur.com/gallery/wlpfoIV,Factory,Event (Legacy HAS only),,first siege 2m and 3m
7/26/2021 21:22:18,v,2269756,Giggity,https://imgur.com/a/H7eZQsN,Mega-3,2TDM,Highest Arras Scores,"Giggity#8267 (HAS only, Shit ratio cuz I waited an hour to get restored lol)"
7/26/2021 21:28:24,v,2377909,bird,https://imgur.com/gallery/90RFqV9,Flank Guard,2TDM,Highest Arras Scores,bird#1809 and read notes on the imgur
7/26/2021 23:19:47,v,1211516,Giggity,https://imgur.com/a/z7fTjBn,Mega-3,Squads-Duos,,Giggity#8267
7/26/2021 23:20:13,x,1731516,PlayerX,"https://imgur.com/WKO2CFM
https://imgur.com/mZnbb4j
https://imgur.com/h6QQ5ru
",Hexa Trapper,2TDM,Secondary Record,um i dont have these things
7/27/2021 2:53:00,v,1619933,you tried ☆,https://imgur.com/a/s2vbKG3,Sidewinder,Squads-Duos,,
7/27/2021 7:42:12,v,1060526,Mine,https://imgur.com/a/bMRwh6x,Carrier,Open Maze TDM,,
7/27/2021 9:05:33,x,1154663,Minecraft1.15Update!,"blob:https://arras.io/776c8956-7641-4aaf-8d65-4cc11603f8c3
blob:https://arras.io/405fda8e-55b2-4cdc-8298-863b8bda35d0
",Spreadshot,Squads-Duos,Secondary Record,1154663Score Disconneted
7/27/2021 11:13:26,v,2669130,Awootube,https://imgur.com/a/fexo4GM,Builder,Squads-Duos,Highest Arras Scores,"yoooo wtf run, pred is fat in a 3v1 i found out today"
7/27/2021 11:58:54,v,2551913,WL9,https://cdn.discordapp.com/attachments/867876603370930236/869609329718870077/screenshot_-_2021-07-27T115443.060.png,Artillery,Squads-Duos,Highest Arras Scores,"I have a lot of good survivals and some fatass chases me with max movement speed, I hate my luck."
7/27/2021 16:44:03,v,2252924,Corrupt X,https://imgur.com/a/V3N8cEQ,Hewn Double,Open TDM,Highest Arras Scores,
7/28/2021 0:13:02,x,1610219,Pain痛み,https://imgur.com/a/f5ifb4S,Auto Spawner,Open Maze TDM,Secondary Record,Pain痛み#9372
7/28/2021 8:55:57,v,2030215,Mine,https://cdn.discordapp.com/attachments/395646588682240020/869924869511475251/screenshot_-_2021-07-28T055010.395.png,Necromancer,4TDM,Highest Arras Scores,pro ratio cause i was messing around in vc with allor
7/28/2021 14:55:06,v,2290699,<❂> 𝓪𝓵𝓲۷𝓮🌹,https://imgur.com/a/VcWoNGH,Bomber,2TDM,Highest Arras Scores,<❂> 𝓪𝓵𝓲۷𝓮🌹#1628
7/28/2021 15:38:55,v,250000,je7,https://imgur.com/a/qu6HPdp,(Basic) Tank,Maze,Secondary Record,
7/28/2021 17:02:22,v,679279,Mine,https://cdn.discordapp.com/attachments/395646588682240020/869997615008342046/screenshot_-_2021-07-28T103909.149.png,Sidewinder,Open Maze TDM,,the link doesnt work for the old record so im submitting this
7/28/2021 19:36:27,v,3702089,asd,https://imgur.com/gallery/1VrUPlH,Auto Smasher,2TDM,Highest Arras Scores,
7/28/2021 20:55:11,v,2323646,Legenda,https://imgur.com/a/eW467pO,Rocketeer,2TDM,Highest Arras Scores,Legenda#0001
7/29/2021 2:22:27,v,4128691,ASkib,https://imgur.com/a/irh3Mma,Hunter,Portal 4TDM,Highest Arras Scores,ASkib#3333
7/29/2021 9:20:13,x,1023236,amToast,https://imgur.com/a/j2kiM14,Tri-Trapper,Open TDM,,Toast?#2110
7/29/2021 13:21:55,v,1003724,je7,https://imgur.com/a/uLlYgjI,Mega Smasher,Squads-Duos,,Beat my own Squads Mega-Smasher wr once again
7/29/2021 15:09:18,v,3777000,New Plan,https://imgur.com/a/S3FCL3Z,Commander,2TDM,Highest Arras Scores,"Cant#7643 I don't know if it's worth it without the death ss, and the score is 3777000 because I don't know the exact score, but I died with 3.77"
7/29/2021 15:10:54,v,1452602,Giggity,https://imgur.com/a/paADADh,Mega-3,Maze,,Giggity#8267 (My first 1m+ maze record)
7/29/2021 18:11:52,v,1424769,Chaos,https://imgur.com/a/vxZA6Ax,Armsman,Open TDM,,idk
7/29/2021 23:06:35,v,1087597,you tried ☆,https://imgur.com/a/sr2fs9w,Tri-Trapper,Open TDM,,
7/29/2021 23:21:31,v,2874518,1,https://media.discordapp.net/attachments/846007853487358003/846008030663278625/unknown.png,Surfer,Open TDM,Highest Arras Scores,
7/29/2021 23:23:09,v,2348911,1,https://media.discordapp.net/attachments/846007853487358003/846008238994227220/unknown.png,Fighter,FFA,Highest Arras Scores,
7/29/2021 23:24:28,v,2369183,1,https://media.discordapp.net/attachments/846007853487358003/852463284262273044/unknown.png,Fighter,Squads-Duos,Highest Arras Scores,
7/29/2021 23:26:06,v,2011794,1,"https://media.discordapp.net/attachments/846007853487358003/866312466841206794/unknown.png
",Octo Tank,Open TDM,Highest Arras Scores,
7/30/2021 3:24:00,v,1208174,you tried ☆,https://imgur.com/a/SzYWRKo,Rocketeer,Open Maze TDM,,
7/30/2021 6:02:51,v,1145412,Smiley,https://imgur.com/a/BoEXWMm,Director,Maze,,
7/30/2021 8:03:55,v,3245785,poui,https://media.discordapp.net/attachments/799981364157612043/870584415540113468/unknown.png,Ordnance,Open Maze TDM,Highest Arras Scores,poui#2675
7/30/2021 17:19:34,v,2376116,Chaos,https://imgur.com/a/4xr6cJb,Beekeeper,2TDM,Highest Arras Scores,HAS only (idk I I summit if I did then srry)
7/30/2021 18:38:12,v,2316820,Giggity,https://imgur.com/a/dfXkC1J,Bulwark,4TDM,Highest Arras Scores,"Giggity#8267 (HAS only, was restored)"
7/30/2021 23:07:33,v,2192039,WL9,https://cdn.discordapp.com/attachments/718244128743227422/870864952544596008/screenshot_-_2021-07-30T230405.706.png,Factory,Event (Legacy HAS only),Highest Arras Scores,My computer is lucky to be alive from how many times I've smashed it.
7/31/2021 0:24:24,v,1594905,cutie egirl,https://imgur.com/a/60MCwkT,Spawner,2TDM,,carrot op
7/31/2021 1:23:16,x,1377481,timing,"blob:https://arras.io/f44790df-e9c6-47ce-ba3f-b1de09886d44
blob:https://arras.io/bdf8acf6-e603-487e-a65d-21bc38ffeca1
blob:https://arras.io/cbf31303-3fd4-4532-996e-92fa9a7bd0db
blob:https://arras.io/2ca83666-1cf0-4315-8300-1e1ca4550abc
blob:https://arras.io/63270cd8-146d-4564-94a7-0a3f1bdd384b
",Hunter,Maze 4TDM,Secondary Record,im nood
7/31/2021 7:42:10,v,1283025,Guar4ian.,https://imgur.com/a/QMEgPvX,Commander,Squads-Duos,,Guar4ian#6704
7/31/2021 8:09:45,v,1085498,Awootube,https://imgur.com/a/LJCuO2F,Hexa Trapper,Open TDM,,i love otdm
7/31/2021 16:55:43,v,752888,KSK,https://imgur.com/gallery/3DzUDjs,Bomber,Maze 2TDM,,KSK#3137
7/31/2021 18:17:40,v,2549088,KSK,https://imgur.com/gallery/gcuP2gG,Factory,Event (Legacy HAS only),Highest Arras Scores,KSK#3137
7/31/2021 20:42:12,v,1523110,Giggity,https://imgur.com/a/RFESYZy,Mega-3,Portal 4TDM,,Giggity#8267
7/31/2021 21:29:59,v,2013208,je7,https://imgur.com/a/0VyHtKQ,Mega Smasher,Squads-Duos,Highest Arras Scores,Submission for both Squads-Duos Mega-Smasher WR and HAS
8/1/2021 0:14:57,x,1037898,Beater-Octo_Tank,"blob:https://arras.io/4bb0f41f-cb30-41ad-af01-3cb07af3c55d
blob:https://arras.io/6b9431b8-ffc8-4bae-89ac-f595083fdca0
blob:https://arras.io/3689325c-6136-4864-91df-5885e780d2d4
blob:https://arras.io/6bac6fe5-3be9-439e-a896-960930ceceb8
blob:https://arras.io/4bb0f41f-cb30-41ad-af01-3cb07af3c55d",Octo Tank,Portal 4TDM,Secondary Record,1037898 score disconnected
8/1/2021 3:27:04,v,3111695,ASkib,https://media.discordapp.net/attachments/731494808475926531/871290228923592704/screenshot_-_2021-08-01T141557.807.png,Overseer,2TDM,Highest Arras Scores,ASkib#3333
8/1/2021 5:47:09,v,1434352,8,https://imgur.com/a/C2xBb2Q,Overgunner,Maze,,
8/1/2021 7:00:19,v,2636899,ExC,https://media.discordapp.net/attachments/395646588682240020/871344780104314900/image0.png,Triplet,Open Maze TDM,Highest Arras Scores,49 looks bad
8/1/2021 8:07:46,v,1672817,For Kenza 🌹,https://imgur.com/a/EEssQvg,Triple Twin,Portal 4TDM,,Alissa#1237
8/1/2021 8:14:05,v,1352320,Mine,https://imgur.com/a/8vG1LVU,Surfer,Open Maze TDM,,
8/1/2021 8:51:46,x,2636899,ExC,https://media.discordapp.net/attachments/395646588682240020/871344780104314900/image0.png,Triplet,Open Maze TDM,Highest Arras Scores,49 looks bad
8/1/2021 12:15:28,v,2277449,Buddy_Dog,https://imgur.com/gallery/jkHgrld,Overlord,2TDM,Highest Arras Scores,Sea#8033
8/1/2021 14:20:26,v,2627582,Icewalk,https://imgur.com/a/uEr5ifB,Poacher,FFA,Highest Arras Scores,Icewalk#2905
8/1/2021 18:23:31,v,1558328,amToast,https://imgur.com/a/LwYXqEZ,Tri-Trapper,2TDM,,Toast?#2110 | bruh add my discord id to the discord bot already smh
8/1/2021 20:53:44,v,1137927,for a few dollars more,https://imgur.com/gallery/Ld4w7ph,Stalker,Squads-Duos,,tank 32
8/1/2021 22:40:23,x,1556900,Giggity,https://imgur.com/a/jNPpwUk,Mega-3,Open Maze TDM,,Giggity#8267 
8/1/2021 22:41:35,v,2050835,bird,https://imgur.com/gallery/sPNurtu,Mortar,4TDM,Highest Arras Scores,bird#1809
8/1/2021 23:41:40,x,1610866,KING :D,https://discord.com/channels/366661839620407297/395646588682240020/871597135693484092,Booster,Squads-Duos,Highest Arras Scores,Unknown~#0001
8/1/2021 23:44:24,x,1610866,KING,https://discord.com/channels/366661839620407297/395646588682240020/871597135693484092,Booster,Squads-Duos,Secondary Record,Unknown~#0001
8/1/2021 23:53:40,v,5054356,noscore,https://imgur.com/gallery/BU63NCs,Ordnance,Squads-Duos,Highest Arras Scores,
8/1/2021 23:54:32,v,3730044,noscore,https://media.discordapp.net/attachments/627059049678110741/871600828815925308/unknown-15.png,Necromancer,4TDM,Highest Arras Scores,HAS Only
8/1/2021 23:55:43,v,2100405,noscore,https://media.discordapp.net/attachments/627059049678110741/871601828251451412/unknown-6-1.png,Manager,2TDM,Highest Arras Scores,HAS Only
8/1/2021 23:58:16,x,1618728,Unknown,https://imgur.com/UnmSfms,Booster,Squads-Duos,Secondary Record,Unknown~#0001
8/2/2021 0:05:09,x,1618728,KING,"https://imgur.com/bLghKx5 ,https://imgur.com/u4r59Qv",Booster,Squads-Duos,,Unknown~#0001
8/2/2021 0:13:09,x,1610866,KING,https://imgur.com/u4r59Qv,Booster,Squads-Duos,,Unknown~#0001
8/2/2021 6:49:37,v,2144129,ASkib,https://media.discordapp.net/attachments/395646588682240020/871705830632865792/unknown.png,Manager,Portal 4TDM,Highest Arras Scores,ASkib#3333
8/2/2021 9:52:49,x,1931294,Stardust,https://media.discordapp.net/attachments/395646588682240020/871751797574873088/unknown.png,Triple Twin,Open TDM,,Vangu#8674
8/2/2021 9:58:36,v,1931294,Stardust,https://imgur.com/gallery/l0OnBQ9,Triple Twin,Open TDM,,Vangu#8674
8/2/2021 10:47:44,x,1407193,Darky,https://imgur.com/a/riFQqVD,Single,Squads-Duos,,Just Dark?#8336
8/2/2021 11:40:06,x,1039634,Levi,https://media.discordapp.net/attachments/855688391496695809/870686476772442192/screenshot_41.png,Beekeeper,Maze,Secondary Record,i didnt submit my discord tag on my last to wr's (radiocre 1.3 crossbow 1.7 bomber both maze) so if its possible i would like to change its name from radiocre to Levi and set the disc tag as LeviObsessed#1605 thank you. 
8/2/2021 11:52:15,x,1069605,Levi,https://media.discordapp.net/attachments/856443634614665244/871781305640185956/screenshot_-_2021-07-31T133025.580.png,Sniper,2TDM,Secondary Record,LeviObsessed#1605
8/2/2021 11:54:21,x,1021780,Levi,https://media.discordapp.net/attachments/856443634614665244/871781727784284170/Screenshot_2021-04-23_19.30.01_1.png,Destroyer,Maze,Secondary Record,LeviObsessed#1605
8/2/2021 15:05:50,v,2742207,NeonLights,https://imgur.com/a/RZ4IsBJ,Predator,Squads-Duos,Highest Arras Scores,
8/2/2021 15:44:04,v,2655776,noscore,https://media.discordapp.net/attachments/627059049678110741/871840336018833489/unknown-25.png,Auto Overseer,4TDM,Highest Arras Scores,HAS Only
8/2/2021 16:28:40,v,1472822,Mine,https://imgur.com/a/lQFQk2F,Maleficitor,Squads-Duos,,
8/2/2021 19:49:33,v,2088444,New Plan,https://cdn.discordapp.com/attachments/866051297266761761/871900761049677874/screenshot_15.png,Overseer,4TDM,Highest Arras Scores,Cant#7643 why im so stupid when die
8/2/2021 20:54:52,x,5025526,ParagonUltima,https://cdn.discordapp.com/attachments/602898865858936855/659468519242465311/screenshot_-_2019-12-25T105211.747.png,Trapper,Maze,Highest Arras Scores,expo#0001
8/2/2021 20:55:32,x,3501203,ParagonUltima,https://cdn.discordapp.com/attachments/602898865858936855/663074492351905792/unknown.png,Octo Tank,FFA,Highest Arras Scores,expo#0001
8/2/2021 20:56:33,x,3122303,ParagonUltima,https://cdn.discordapp.com/attachments/602898865858936855/666459752959836170/unknown.png,Auto Overseer,Open TDM,Highest Arras Scores,expo#0001
8/2/2021 20:56:53,x,3183753,ParagonUltima,https://cdn.discordapp.com/attachments/602898865858936855/658776454208815114/Screenshot_831.png,Artillery,FFA,Highest Arras Scores,expo#0001
8/2/2021 20:58:13,x,4979153,ParagonUltima,https://cdn.discordapp.com/attachments/602898865858936855/663185454249541673/screenshot_-_2020-01-04T200134.161.png,Annihilator,4TDM,Highest Arras Scores,expo#0001
8/2/2021 20:59:13,x,4630541,Rafadoesntplay134,https://cdn.discordapp.com/attachments/602886543463415843/790100629506621450/screenshot_19.png,~~Other~~,Maze,Highest Arras Scores,expo#0001
8/2/2021 22:48:31,v,2182004,Darky,https://imgur.com/a/w1EZakH,Necromancer,2TDM,Highest Arras Scores,Just Dark?#8336
8/2/2021 23:30:04,v,2062300,ASkib,https://cdn.discordapp.com/attachments/731494808475926531/871957591503286342/unknown.png,Auto Overseer,2TDM,Highest Arras Scores,ASkib#3333
8/3/2021 0:36:49,v,1377836,Giggity,https://imgur.com/a/BVt09Dn,Rocketeer,FFA,,Giggity#8267
8/3/2021 2:21:49,v,1943856,ASkib,https://imgur.com/a/bIcUsd1,Builder,2TDM,,ASkib#3333
8/3/2021 4:15:16,x,1459011,Darky,https://imgur.com/a/FbhMdn7,Single,Open TDM,,Just Dark?#8336
8/3/2021 6:02:25,v,2349701,🥕Crazy Carrot🥕,https://media.discordapp.net/attachments/579412094986878976/872016580521914398/screenshot_1.png?,Overlord,Portal 4TDM,Highest Arras Scores,🥕Crazy Carrot🥕#9982
8/3/2021 7:17:29,v,2298119,For Kenza 🌹,https://imgur.com/a/6U0dOOK,Shotgun,Maze 2TDM,Highest Arras Scores,Alissa#1237
8/3/2021 12:01:40,v,3072729,For Kenza 🌹,https://imgur.com/a/SqgFPTe,Rocketeer,2TDM,Highest Arras Scores,Alissa#1237
8/3/2021 12:19:03,v,1412118,Mine,https://imgur.com/a/FLN92Lz,Stalker,Open Maze TDM,,
8/3/2021 15:20:51,v,2047868,Mine,https://imgur.com/a/T5b5fi6,Armsman,Open TDM,Highest Arras Scores,
8/3/2021 16:15:28,x,1239450,amToast,https://imgur.com/a/FsgZCm5,Maleficitor,FFA,,Toast?#2110 hi
8/3/2021 16:49:16,v,6052919,microwave,https://imgur.com/a/FTIVvxa,Spike,FFA,Highest Arras Scores,Rog456#8103
8/3/2021 18:58:08,v,2806715,New Plan,https://cdn.discordapp.com/attachments/866051297266761761/872250075039014942/screenshot_26.png,Auto Overseer,2TDM,Highest Arras Scores,Cant#7643 luisprogamer69 kill me :000wtf
8/3/2021 20:11:15,x,869203,Mine,https://imgur.com/a/Mns8vKy,Maleficitor,Open Maze TDM,,
8/4/2021 3:58:09,v,3245785,poui,https://cdn.discordapp.com/attachments/731494808475926531/872387657177657354/unknown.png,Ordnance,Open Maze TDM,Highest Arras Scores,poui#2675
8/4/2021 6:41:59,v,2040928,🥕Crazy Carrot🥕,https://media.discordapp.net/attachments/579412094986878976/872429014709583892/screenshot_3.png?,Overlord,FFA,Highest Arras Scores,🥕Crazy Carrot🥕#9982
8/4/2021 9:51:41,v,5224008,asd,https://imgur.com/gallery/UuDS6Xr,Landmine,4TDM,Highest Arras Scores,
8/4/2021 9:54:58,v,3058476,Awootube,https://imgur.com/a/hXa9Wk2,Landmine,FFA,Highest Arras Scores,IM RELAVENT NOW YESSSSSSSS (rog you can take the wr i just wanted 3m)
8/4/2021 22:21:24,v,7399044,asd,https://imgur.com/gallery/Fb8K4hx,Spike,4TDM,Highest Arras Scores,Aphorism#1647
8/4/2021 22:39:36,v,2260800,Giggity,https://imgur.com/a/RiNANsp,Mega-3,Open TDM,Highest Arras Scores,Giggity#8267 (Finally a chill server lmao)
8/5/2021 0:14:04,v,2305735,<❂> ₭ǿrɇa,https://cdn.discordapp.com/attachments/790131315139543040/871308655520276531/screenshot_-_2021-08-01T152601.769.png,Octo Tank,2TDM,Highest Arras Scores,HAS please.
8/5/2021 2:22:31,v,2983391,ASkib,https://media.discordapp.net/attachments/731494808475926531/872725684932456448/unknown.png,Overdrive,4TDM,Highest Arras Scores,ASkib#3333
8/5/2021 2:25:45,v,2642021,ASkib,https://media.discordapp.net/attachments/731494808475926531/872371302999158804/unknown.png,Overlord,4TDM,Highest Arras Scores,
8/5/2021 3:53:07,x,2610508,Wheat Thins,https://imgur.com/gallery/n0GDN2l,Maleficitor,2TDM,Highest Arras Scores,cool
8/5/2021 6:39:19,v,3008250,Darky,https://imgur.com/a/gEKs1cH,Predator,Open TDM,Highest Arras Scores,Just Dark?#8336
8/5/2021 6:53:44,v,3408183,loaf,https://media.discordapp.net/attachments/395646588682240020/872723194598006794/screenshot_-_2021-08-05T140812.230.png,Predator,FFA,Highest Arras Scores,`
8/5/2021 7:11:28,v,2728001,Stardust,https://imgur.com/gallery/f4ugQ3V,Auto Overseer,4TDM,Highest Arras Scores,Vangu#8674
8/5/2021 7:30:05,v,2238051,Rev,https://cdn.discordapp.com/attachments/866890462555144232/872789509526417458/unknown.png,Fighter,4TDM,Highest Arras Scores,HAS only
8/5/2021 8:15:32,v,1551770,you tried ☆,https://imgur.com/a/kQsm5Vz,Eagle,Open TDM,,
8/5/2021 9:41:10,v,1772012,From Asia,https://imgur.com/a/Mjatd88,Mega-3,Portal 4TDM,,last submit
8/5/2021 9:42:04,v,2537945,Plasmapichu,https://cdn.discordapp.com/attachments/395646588682240020/859911319222616114/screenshot_-_2021-06-14T152420.109.png,Carrier,FFA,Highest Arras Scores,Plasma!#6669
8/5/2021 15:45:43,v,2052627,Heir,https://cdn.discordapp.com/attachments/790400452528963604/872927585758232596/screenshot_-_2021-08-05T123557.949.png,Overlord,FFA,Highest Arras Scores,
8/5/2021 19:18:39,v,2201986,Sonder,https://imgur.com/gallery/r1aazWm,Landmine,Open TDM,Highest Arras Scores,
8/5/2021 20:12:23,x,1604153,Chaos,https://imgur.com/a/x2utlxr,Mega Smasher,Maze,,teamers be everywhere to stop me
8/5/2021 22:42:39,v,4234540,ASkib,https://imgur.com/a/drlhkJ6,Poacher,4TDM,Highest Arras Scores,ASkib#3333
8/5/2021 22:47:03,v,1363315,69,https://imgur.com/a/Cd7zbqS,Hunter,Maze 2TDM,,
8/6/2021 2:16:36,v,3016876,Thx m8,https://cdn.discordapp.com/attachments/747714118118670378/873082862491017286/screenshot_-_2021-08-06T115908.428.png,Triplet,FFA,Highest Arras Scores,Has only.
8/6/2021 5:10:58,v,2212146,Darky,https://imgur.com/a/qWYwVm4,Poacher,FFA,Highest Arras Scores,Just Dark?#8336
8/6/2021 5:54:48,v,2050217,Stardust,https://imgur.com/gallery/byTKIUr,Overtrapper,4TDM,Highest Arras Scores,Vangu#8674
8/6/2021 8:25:22,x,1081661,2m,"blob:https://arras.io/0955ff85-98dd-483f-aa33-89fde9dc7daf
blob:https://arras.io/16503ebe-61e4-490a-ae62-5c790a142dda",Twister,Squads-Duos,Secondary Record,GG's!
8/6/2021 9:31:09,v,1147365,amToast,https://media.discordapp.net/attachments/836342692187209761/873196187811975178/screenshot_63.png,Eagle,Open Maze TDM,,hello mine | Toast?#2110
8/6/2021 10:15:49,v,2179294,Break Your Limits,https://imgur.com/gallery/aNN7f8a ,Spike,4TDM,Highest Arras Scores,HAS only
8/6/2021 10:18:16,v,1761959,Smiley,https://imgur.com/a/7n7OcD4,Overtrapper,Maze,,
8/6/2021 10:54:52,v,1211695,For Kenza 🌹,https://imgur.com/a/ZhvkMNL,Rocketeer,Open Maze TDM,,Alissa#1237
8/6/2021 12:00:52,v,2670219,Thx m8,https://cdn.discordapp.com/attachments/747714118118670378/873233429393731584/screenshot_-_2021-08-06T215716.300.png,Twin,Squads-Duos,Highest Arras Scores,HAS only.
8/6/2021 16:10:42,v,2697731,Heir,https://cdn.discordapp.com/attachments/557386978782609428/873296536518393906/screenshot_-_2021-08-06T130609.423.png,Overdrive,4TDM,Highest Arras Scores,
8/6/2021 17:08:22,v,4049095,New Plan,https://cdn.discordapp.com/attachments/858825469231104030/873310406964297748/screenshot_5.png,Auto-Assassin,4TDM,Highest Arras Scores,"Cant#7643why they added rt, I want the quad tank ;;;"
8/6/2021 17:13:32,v,2227639,New plan,https://cdn.discordapp.com/attachments/851589232799907851/852629055148392478/screenshot_3.png,Streamliner,4TDM,Highest Arras Scores,Cant#7643  is old lol
8/6/2021 17:22:39,v,2111203,New Plan,https://cdn.discordapp.com/attachments/864672379652276256/864697659993620480/screenshot_14.png,Commander,2TDM,Highest Arras Scores,"Cant#7643 I never restored this, it has a long time, and if it is possible to restore talk to me lol or if you need another test because I took the capture after I disconnected by akf"
8/6/2021 23:12:13,v,1415722,cutie egirl,https://media.discordapp.net/attachments/794354649842188318/872987522983141426/Screen_Shot_2021-08-01_at_5.36.37_PM.png,Booster,Squads-Duos,,limit gone :pensive:
8/6/2021 23:13:26,v,2859878,cutie egirl ,https://imgur.com/a/AnY6Vv3,Spawner,4TDM,Highest Arras Scores,limit gone :pensive:
8/6/2021 23:14:37,v,2050652,cutie egirl,https://imgur.com/a/TNuWY80,Fortress,Open TDM,Highest Arras Scores,limit gone :pensive:
8/6/2021 23:59:54,v,1504463,cutie egirl,https://imgur.com/a/037E3By,Commander,Squads-Duos,,limit gone :pensive:
8/7/2021 0:13:44,x,1157107,ken--,"https://cdn.discordapp.com/attachments/836342692187209761/873418419897245726/screenshot_22.png
death :https://cdn.discordapp.com/attachments/836342692187209761/873417767204823070/screenshot_23.png",Booster,Squads-Duos,Secondary Record,ken-- ⏣#2635
8/7/2021 5:20:16,v,2138045,// jAX,https://media.discordapp.net/attachments/869109751450066946/873491970625011772/screenshot_3.png?,Spike,Maze,Highest Arras Scores,Trouble#3298 - one of my most STOP THE CAP and REEEEEEEEEE kind of runs.  i will not describe it to you personally.
8/7/2021 7:47:04,v,1151261,For Kenza 🌹,https://imgur.com/a/BGTx3Cv,Rocketeer,Maze 2TDM,,Alissa#1237
8/7/2021 9:01:27,x,6079456,Dylan-for Project Unity,https://imgur.com/a/XpUqeWH,Auto Tri-Angle,FFA,Highest Arras Scores,Dylan-Submitted For Project Unity
8/7/2021 10:16:48,v,822533,<❂> 𝓪𝓵𝓲۷𝓮🌹,https://imgur.com/a/MaJpeF0,Surfer,Maze 2TDM,,<❂> 𝓪𝓵𝓲۷𝓮🌹#1628
8/7/2021 11:13:16,x,1577787,Stardust,https://media.discordapp.net/attachments/869109751450066946/873583957445337098/unknown.png,Swarmer,Maze,,Vangu#8674
8/7/2021 11:26:16,v,1577787,Stardust,https://imgur.com/gallery/Mxwpx8y,Swarmer,Maze,,Vangu#8674
8/7/2021 12:29:07,v,6116243,for a few dollars more,https://imgur.com/gallery/XPAg66T,Mega Smasher,4TDM,Highest Arras Scores,fan of plan
8/7/2021 12:40:17,v,5159983,ByEkc,https://imgur.com/a/AG2eOtt,Rocketeer,Maze 2TDM,Highest Arras Scores,byekc#0027
8/7/2021 13:01:03,v,2937486,8,https://imgur.com/a/gCoaoDd,Skimmer,4TDM,Highest Arras Scores,"My ratio is garbage cause I had no prot really,AKFed for a long time and got hunted for ages."
8/7/2021 13:04:14,v,1503383,amToast,https://imgur.com/a/CF2Tj0o,Mega Smasher,Maze 2TDM,,mega smash Toast?#2110
8/7/2021 13:47:28,v,2281863,bird,https://imgur.com/gallery/up92DcA,Manager,4TDM,Highest Arras Scores,"bird#1809 (I didn't have all the SS however my friends took few ss, they aren't my pov) "
8/7/2021 14:35:55,x,7263209,asd,https://imgur.com/gallery/V7obwhP,Landmine,4TDM,Highest Arras Scores,"Aphorism#1647, that would be cool if i can claim my stats"
8/7/2021 16:34:11,v,3603858,bird,https://imgur.com/gallery/STJD37k,Twin,2TDM,Highest Arras Scores,bird#1809
8/7/2021 19:35:00,v,2016074,Break Your Limits,https://imgur.com/gallery/NBZXQ4u ,Spike,2TDM,Highest Arras Scores,died while on afk script in base lol (cancer server lmao)
8/8/2021 1:28:01,v,1866940,[The Ultimate],https://imgur.com/a/hB3smE5,Engineer,2TDM,,[The Ultimate]#7041
8/8/2021 3:29:42,x,260012,E<M,link:https://discord.com/invite/yqBWVnj,Barricade,Maze 4TDM,Secondary Record,
8/8/2021 7:12:26,x,696969,Stardust,http://ok,~~Other~~,FFA,,"change my sheet name to ""Stardust"" please thx"
8/8/2021 8:08:49,v,838318,[K] Sirius,https://gall.dcinside.com/mgallery/board/view/?id=arrasio1&no=112&page=1,Tri-Angle,Open Maze TDM,,
8/8/2021 11:25:49,v,1864964,For Kenza 🌹,https://imgur.com/a/kdiALpe,Twister,Open TDM,,Alissa#1237
8/8/2021 12:02:51,v,3178450,Yusuf 100,https://i.imgur.com/i4YxeAM.png,Overdrive,Squads-Duos,Highest Arras Scores,Yusuf 100#8706
8/8/2021 17:48:00,v,3668753,bird,https://imgur.com/a/AEok9Qq,Machine Gun,2TDM,Highest Arras Scores,bird#1809
8/8/2021 17:49:29,v,1871001,New Plan,https://imgur.com/a/U1bpU9L,Fortress,2TDM,,Cant#7643 hola:)
8/8/2021 18:54:55,x,250000,[Ω]Revenge,"I started filling this form out and then went back for a screen shot for proof, but they weren't they're after. I'm 99% sure they're hacking me. If I see them, I will submit a screen shot. Nonsense link so I can submit this form: https://arras.io/#wf",Annihilator,FFA,,"My name is being stolen across all servers. I usually use [Ω]Revenge and every time I change it, so does this other person except they use this symbol I think:❂. I don't know if they're hacking or what, but it's really annoying. Please ban them if possible."
8/8/2021 23:31:54,v,1432526,Darky,https://imgur.com/a/EOhbPDu,Auto Spawner,Squads-Duos,,Just Dark?#8336
8/9/2021 0:08:47,v,3252800,Mine,https://imgur.com/a/z03M6X3,Sprayer,Open Maze TDM,Highest Arras Scores,
8/9/2021 0:28:27,v,2580691,WL9,https://cdn.discordapp.com/attachments/718244128743227422/874146681854251008/screenshot_-_2021-08-09T000336.318.png,Smasher,4TDM,Highest Arras Scores,"Took these damn hunters like 7,900 tries to get me, they're so bad lol."
8/9/2021 3:45:57,x,1830994,Colourful,https://www.reddit.com/r/Diep2io/comments/p0wra0/183_booster_wr_on_982021/,Booster,Squads-Duos,,Bōrteradr#6570
8/9/2021 4:36:03,x,528151,KrISt,https://imgur.com/a/qvbOLYn,Octo Tank,4TDM,Highest Arras Scores,
8/9/2021 4:56:25,v,2757503,🥕Crazy Carrot🥕,https://media.discordapp.net/attachments/579412094986878976/874212950825656390/screenshot_18.png?,Smasher,2TDM,Highest Arras Scores,🥕Crazy Carrot🥕#9982
8/9/2021 6:49:06,v,1573074,Rev,https://imgur.com/a/IReDJba,Auto Spawner,Maze 2TDM,,
8/9/2021 7:18:57,v,1474889,For Kenza 🌹,https://imgur.com/a/MQ04lRd,Twister,Maze,,Alissa#1237
8/9/2021 8:41:03,v,4180899,noscore ,https://imgur.com/gallery/aB8EJze,Twister,4TDM,Highest Arras Scores,
8/9/2021 8:44:50,v,2223346,noscore ,https://media.discordapp.net/attachments/627059049678110741/874271408593702912/unknown-25.png,Overdrive,2TDM,Highest Arras Scores,
8/9/2021 8:52:39,v,2171402,Smiley,https://imgur.com/a/WxrHtBu,Artillery,Maze,Highest Arras Scores,WR+HAS
8/9/2021 14:41:04,v,1162071,cutie egirl,https://media.discordapp.net/attachments/873361531537076244/874358911212322886/Screen_Shot_2021-08-09_at_11.21.11_AM.png,Fortress,Open Maze TDM,,bodyblocked for anak lol
8/9/2021 15:42:06,v,2691984,Awootube,https://imgur.com/a/Z5ejzHs,Mega-3,FFA,Highest Arras Scores,i stole neonlights kill :(((((
8/9/2021 17:24:44,v,4280146,[LK],https://imgur.com/a/pFtwi8X,Flank Guard,FFA,Highest Arras Scores,Funny death
8/9/2021 22:27:54,x,601338,Marcusicoi,https://media.discordapp.net/attachments/874192412191391804/874478876909252618/Screenshot_20210802_153803.jpg,Hybrid,Maze,,commonly rejected because i didn't put the DC screen
8/10/2021 1:31:33,v,1458591,Darky,https://imgur.com/a/yJ9w8nR,Tri-Angle,Maze 4TDM,,Just Dark?#8336
8/10/2021 2:29:44,x,343481,Hybrid,https://imgur.com/5XHd7vp,Hybrid,Maze,Secondary Record,Hybrids are OP
8/10/2021 6:29:33,v,3501351,New Plan,https://imgur.com/a/X3mMk9x,Crossbow,4TDM,Highest Arras Scores,Cant#7643 holaaa
8/10/2021 9:18:10,v,5879617,ByEkc,https://imgur.com/a/uV9goB2,Auto Spawner,4TDM,Highest Arras Scores,byekc#0027
8/10/2021 12:57:36,v,3565372,O'Chunks,https://imgur.com/gallery/GRMnYUz,Landmine,2TDM,Highest Arras Scores,O'Chunks#7524
8/10/2021 13:38:57,v,2204182,Rosencrantz and Guildenstern,https://imgur.com/a/o2Xuok8,Overdrive,4TDM,Highest Arras Scores,back
8/10/2021 13:40:24,v,3544483,Rosencrantz and Guildenstern,https://imgur.com/a/Zq83t8v,Spike,2TDM,Highest Arras Scores,back
8/10/2021 14:53:18,v,3001129,Heir,https://cdn.discordapp.com/attachments/790400452528963604/874726067221438494/screenshot_-_2021-08-10T114724.409.png,Smasher,2TDM,Highest Arras Scores,it sucks when you don't have time
8/10/2021 17:12:51,v,2073654,Majira???,https://imgur.com/gallery/fpH8rdB,Smasher,2TDM,Highest Arras Scores,"died to a lag spike with no proof, yey."
8/10/2021 17:48:35,v,4012142,O'Chunks,https://imgur.com/gallery/EQk3JIH,Skimmer,2TDM,Highest Arras Scores,"my internet was shit all summer, so i dc'd a lot, plus i basecamped from 2.2m - 2.4m and from 3m - 3.5m, so it'll prolly get denied for over dc + basecamp but submitting anyway :D"
8/10/2021 18:39:56,x,1252809,Death,https://imgur.com/gIAsa0R,Spike,Maze,Secondary Record,Maze
8/10/2021 21:29:57,v,1283741,raphael,https://cdn.discordapp.com/attachments/874824095777300531/874824231249125407/unknown.png,Mega Smasher,Portal 4TDM,,
8/10/2021 22:16:51,x,1926749,Quad,https://i.imgur.com/VjRx2F6.png,Factory,Maze,,
8/10/2021 22:26:21,v,2215951,jhose aka rev,https://imgur.com/a/hnmw8jI,Auto-5,4TDM,Highest Arras Scores,r_{]EecVeRS{]}{E}{//?{_`+#0001
8/10/2021 22:44:34,v,1556335,69,https://imgur.com/a/CtOLod1,Mega Smasher,Open Maze TDM,,
8/10/2021 23:00:50,v,1926749,Quad,https://imgur.com/a/ryF27xU,Factory,Maze,,
8/11/2021 0:13:20,x,1067977,FAIR Is Back,"blob:https://arras.io/a5f198b6-4fee-4a03-8147-004bb7d9e1f8
blob:https://arras.io/7d512455-9fd0-4648-b2aa-54857d399e3c",Streamliner,Squads-Duos,Secondary Record,anti-rammer is so hard...
8/11/2021 0:58:01,v,1089102,Darky,https://imgur.com/a/vi4TpBP,Tri-Angle,Portal 4TDM,,Just Dark?#8336
8/11/2021 4:58:35,v,625568,[K] Sirius,https://gall.dcinside.com/mgallery/board/view/?id=arrasio1&no=115&page=1,Maleficitor,Open Maze TDM,,
8/11/2021 7:34:26,v,1836398,ASkib,https://imgur.com/a/7ubTkXy,Surfer,Portal 4TDM,,ASkib#3333
8/11/2021 13:13:41,v,2422330,cutie egirl,https://imgur.com/a/FfD9G2k,Fortress,2TDM,Highest Arras Scores,carrot sus
8/11/2021 17:45:58,v,3022311,Thing,https://media.discordapp.net/attachments/795074325212299286/875131751440220220/screenshot_-_2021-08-11T134203.634.png,Spike,2TDM,Highest Arras Scores,spike is chill
8/11/2021 18:57:12,v,2181029,ejv,https://imgur.com/gallery/pg0yALa,Hexa Tank,FFA,Highest Arras Scores,SimeonEJV#5107| I wont be on discord for a while but ill be returning soon.|
8/11/2021 18:58:36,v,2203484,ejv,https://imgur.com/gallery/32k2MEE,Bushwhacker,FFA,Highest Arras Scores,SimeonEJV#5107| Meant For H.A.S|
8/11/2021 19:00:19,v,2034327,ejv,https://imgur.com/gallery/IMCAQAe,Poacher,FFA,Highest Arras Scores,SimeonEJV#5107| Meant For H.A.S|
8/11/2021 19:03:07,v,3096467,ejv,https://imgur.com/gallery/wcQARgu,Twister,4TDM,Highest Arras Scores,SimeonEJV#5107| I got this before Twister got nerfed so I believe this is Meant For L.A.S
8/11/2021 19:05:37,v,3705262,ejv,https://imgur.com/gallery/8dyETU3,Auto Tri-Angle,FFA,Highest Arras Scores,SimeonEJV#5107| I Got this when Quad got his 4.95m Fighter FFA (Gg's to him)|
8/12/2021 1:47:45,v,1379081,deepfreeze,https://imgur.com/a/yDEJSSH,Ordnance,Maze 2TDM,,"hi i am 🌨️ DeepFreeze ❄️, i'd just like to change my world record name to ""deepfreeze"" thanks"
8/12/2021 5:53:22,v,746093,[K] Sirius,https://gall.dcinside.com/mgallery/board/view/?id=arrasio1&no=116&page=1,Hexa Trapper,Open Maze TDM,,please give me a beta tester tool plz
8/12/2021 8:26:35,x,746093,[K] Sirius,https://gall.dcinside.com/mgallery/board/view/?id=arrasio1&no=116&page=1,Hexa Trapper,Open Maze TDM,,
8/12/2021 8:47:59,v,7489909,ByEkc,https://imgur.com/a/AG2eOtt,Rocketeer,Maze 2TDM,Highest Arras Scores,byekc#0027
8/12/2021 11:26:08,v,1823615,8,https://imgur.com/a/j8K68mr,Auto Spawner,2TDM,,
8/12/2021 11:51:24,v,2202412,O'Chunks,https://cdn.discordapp.com/attachments/866023322529955870/875404845237043271/screenshot_-_2021-08-12T104435.799.png,Spike,2TDM,Highest Arras Scores,dont look at the ratio
8/12/2021 12:44:01,v,2584318,Tommy ,https://cdn.discordapp.com/attachments/788900782589870099/875407966516412446/screenshot_50.png,Engineer,Maze,Highest Arras Scores,
8/12/2021 15:10:33,v,7447385,asd,https://imgur.com/gallery/F5FT8Dm,Landmine,4TDM,Highest Arras Scores,
8/12/2021 17:16:55,x,1260211,⨝∑₮ξ₹ͶΛLϿΠΛΘŜ⨝,https://discord.com/channels/366661839620407297/395646588682240020,Banshee,Maze,Secondary Record,"? Sry I dont understand, Long live chaos and RIP the original!"
8/12/2021 20:52:52,v,2160651,bird,https://imgur.com/a/WMiKVOJ,Director,2TDM,Highest Arras Scores,bird#1809
8/12/2021 23:25:37,v,1805957,you tried ☆,https://imgur.com/a/pCqZLuz,Auto Gunner,Open Maze TDM,,
8/12/2021 23:39:21,v,999999,cutie egirl,https://media.discordapp.net/attachments/395646588682240020/875520885707128852/Screen_Shot_2021-08-12_at_4.27.08_PM.png,Assassin,2TDM,Secondary Record,carrots are orange
8/12/2021 23:56:53,v,777553,you tried ☆,https://imgur.com/a/cGbKaox,Maleficitor,Open Maze TDM,,
8/13/2021 2:14:45,x,1025133,🌷|kudo,https://cdn.discordapp.com/attachments/872459960796188675/875622112335913010/unknown.png,Mega Smasher,Open TDM,,🌷|kudo#6705
8/13/2021 2:55:34,v,3182424,🥕Crazy Carrot🥕,https://media.discordapp.net/attachments/845113751258660894/875632872134946826/screenshot_8.png?,Overlord,Portal 4TDM,Highest Arras Scores,solo drones in tdm
8/13/2021 3:12:40,v,1178880,Darky,https://imgur.com/a/vZX1hpR,Mega Smasher,Open TDM,,Just Dark?#8336
8/13/2021 3:31:09,x,863870,[K] Sirius,https://gall.dcinside.com/mgallery/board/view/?id=arrasio1&no=118&page=1,Maleficitor,Open Maze TDM,,
8/13/2021 3:38:46,v,2899336,lamita uwu >.<,https://imgur.com/a/x3ZylHO,Ordnance,2TDM,Highest Arras Scores,lamita#7777
8/13/2021 4:44:33,x,2707429,<❂> ₭ǿrɇa,https://cdn.discordapp.com/attachments/731494808475926531/875660468935622686/screenshot_-_2021-08-09T191543.467.png,Hexa Tank,4TDM,Highest Arras Scores,HAS only
8/13/2021 4:59:08,v,2320462,<❂> ₭ǿrɇa,https://imgur.com/gallery/GEe61w1,Builder,2TDM,Highest Arras Scores,50th 2m
8/13/2021 5:36:58,x,696969,Vangu,http://gg,~~Other~~,FFA,,add my discord tag to the bot: Vangu#6969 (i am stardust)
8/13/2021 5:51:19,v,863870,[K] Sirius,https://gall.dcinside.com/mgallery/board/view/?id=arrasio1&no=118&page=1,Maleficitor,Open Maze TDM,,
8/13/2021 6:06:04,v,1462236,Raptor,https://cdn.discordapp.com/attachments/395646588682240020/875679769591693322/unknown.png,Twister,Portal 4TDM,,Rawr.#5349
8/13/2021 7:10:11,v,4489573,ASkib,https://imgur.com/a/BEKWdYP,Predator,2TDM,Highest Arras Scores,ASkib#3333
8/13/2021 9:07:41,x,2707429,<❂> ₭ǿrɇa,https://cdn.discordapp.com/attachments/731494808475926531/875660468935622686/screenshot_-_2021-08-09T191543.467.png,Hexa Tank,4TDM,Highest Arras Scores,
8/13/2021 9:22:25,v,2707429,<❂> ₭ǿrɇa,https://imgur.com/gallery/9hMWhMP,Hexa Tank,4TDM,Highest Arras Scores,
8/13/2021 15:00:33,x,912414,⨝∑₮ξ₹ͶΛLϿΠΛΘŜ⨝,https://cdn.discordapp.com/attachments/395646588682240020/875814934078967868/unknown.png,Spawner,Maze,Highest Arras Scores,"How can I become a beta user? I really want to advance after that and help build new tanks for arras, love your game too!"
8/13/2021 19:29:31,v,1657450,NeonLights,https://imgur.com/a/96NixEH,Predator,Maze 2TDM,,
8/13/2021 20:32:53,v,1477829,lou,https://imgur.com/a/NXdtK85,Fortress,Maze,,
8/13/2021 22:20:19,x,1115106,PaNcAkE🥞,https://imgur.com/a/Iuvv3Qr,Overdrive,4TDM,,
8/14/2021 0:25:03,v,1146481,raphael,https://cdn.discordapp.com/attachments/731494808475926531/875957706018668614/unknown.png,Mega Smasher,Maze 4TDM,,
8/14/2021 1:05:27,x,1597343,🎧 ØvΞŘⱠ☯rᗪ 🎧#7339,https://www.reddit.com/r/Diep2io/comments/p41usn/gg_nice_run/,Hybrid,Maze,Secondary Record,
8/14/2021 1:10:23,x,1597343,🎧 ØvΞŘⱠ☯rᗪ 🎧#7339,https://www.reddit.com/r/Diep2io/comments/p41usn/gg_nice_run/,Hybrid,Maze,,
8/14/2021 5:11:44,v,1272041, Soma White ღ,https://imgur.com/gallery/Ul1bHER,Overtrapper,Maze 4TDM,,Soma White#4614
8/14/2021 10:11:09,v,1035893,[K] Sirius,https://gall.dcinside.com/mgallery/board/view/?id=arrasio1&no=119&page=1,Fighter,Open Maze TDM,,
8/14/2021 10:32:33,v,1640880,༼Imaginє 🅳𝖗ag๏ns༽,https://imgur.com/a/ccREi0k,Tri-Angle,Maze,,༼Imaginє 🅳𝖗ag๏ns#7289
8/14/2021 12:34:50,v,1963195,bird,https://imgur.com/a/gQqJh73,Trapper,2TDM,,bird#1809
8/14/2021 15:55:19,v,2926418,o_o,https://ibb.co/NZqvLLv,Factory,Event (Legacy HAS only),Highest Arras Scores,o_o#8535 also i didn't do this on ffa i did in siege. I just chose ffa because no option for siege.
8/14/2021 17:25:10,v,2756264,bird,https://imgur.com/a/NXku9Iq,Overlord,4TDM,Highest Arras Scores,bird#1809
8/14/2021 20:55:34,x,1264322,υηηαмє∂ σνєяℓσя∂.,https://media.discordapp.net/attachments/784392997030461460/876266871823929404/unknown.png?,Overlord,Squads-Duos,Secondary Record,
8/14/2021 23:52:24,v,1606674,Darky,https://imgur.com/a/eeQloFJ,Mega Smasher,Maze 4TDM,,Just Dark?#8336
8/14/2021 23:53:17,x,250001,[a letter a],https://this_link_doesnt_exist,Auto 3,4TDM,,"nothing but can u change my name to ""a letter a"""
8/15/2021 4:19:03,x,601338,Marcusicoi,https://www.reddit.com/user/Marcusicoi/comments/p4pn0n/for_wr/?utm_medium=android_app&utm_source=share,Hybrid,Maze,,"2nd attempt, hope it's not rejected"
8/15/2021 5:28:22,v,1583715,raphael,https://imgur.com/a/US0oNBI,Mega Smasher,Open Maze TDM,,
8/15/2021 16:44:42,v,1728264,amToast,https://imgur.com/a/S3SI3z8,Gunner,Squads-Duos,,Toast?#2110 | discord id to discord bot when
8/16/2021 16:44:42,v,1728264,amToast,https://imgur.com/a/S3SI3z9,Gunner,Squads-Duos,,Toast?#2110 | discord id to discord bot when
8/15/2021 19:46:45,x,1234567,road ~ testing something,https://,Annihilator,FFA,,
8/15/2021 19:47:46,x,1234567,road ~ testing something,https://,Auto Builder,Maze 2TDM,,
8/15/2021 21:24:33,v,2187238,je7,https://imgur.com/a/nJtalMH,Landmine,4TDM,Highest Arras Scores,garbage ratio lol
8/16/2021 7:54:19,v,2096832,Smiley,https://imgur.com/a/lQA3ppS,Beekeeper,Maze,Highest Arras Scores,WR+HAS
8/16/2021 7:54:54,v,2541520,joey,https://imgur.com/a/aFs70qC,Auto-Assassin,FFA,Highest Arras Scores,HAS only
8/16/2021 8:03:43,v,2304277,joey,https://imgur.com/a/KUODT9X,Auto Tri-Angle,2TDM,Highest Arras Scores,LAS only
8/16/2021 8:09:53,v,2513971,joey,https://imgur.com/a/Vr2j807,Surfer,2TDM,Highest Arras Scores,LAS only
8/16/2021 8:11:31,x,1850445,名字太长 无法删除(NameToLongCan'tDelete),blob:https://arras.io/0d0e9d03-277a-4714-a0a5-41250fb6322e,Factory,Event (Legacy HAS only),Secondary Record,xd
8/16/2021 8:29:20,v,1854506,<❂> ₭ǿrɇa,https://imgur.com/gallery/3EwP2tX,Overgunner,Maze 4TDM,,
8/16/2021 8:31:32,v,2128603,<❂> ₭ǿrɇa,https://imgur.com/gallery/RPyavY2,Tri-Angle,4TDM,Highest Arras Scores,
8/16/2021 11:46:53,v,2705957,Smiley,https://imgur.com/a/iTGyGaw,Triple Shot,Maze,Highest Arras Scores,WR+HAS
8/16/2021 20:12:33,x,1234926,PaNcAkE🥞,https://imgur.com/a/dn7uQ8v,Booster,FFA,,
8/16/2021 20:51:18,v,2401034,New plan,https://cdn.discordapp.com/attachments/866051297266761761/876990168022810684/screenshot_26.png,Poacher,4TDM,Highest Arras Scores,Cant#7643 i love sniper bro.
8/16/2021 21:59:58,x,1200003,PaNcAkE🥞,https://imgur.com/a/31hPmrN,Mega Smasher,4TDM,,
8/16/2021 22:11:03,x,3102966,名字太长 无法删除,blob:https://arras.io/a6b98737-a0ae-4ed9-a61c-eea9944c7045,Factory,Event (Legacy HAS only),Highest Arras Scores,0/0/5/9/9/9/1/0/0
8/16/2021 23:06:59,v,2763012,asd,https://cdn.discordapp.com/attachments/395646588682240020/876948859006369842/screenshot_-_2021-08-17T005906.327.png,Smasher,4TDM,Highest Arras Scores,
8/17/2021 3:54:56,v,1215148,Colourful,https://www.reddit.com/r/Diep2io/comments/p5za0t/121_dual_wr_open_maze_4tdm_on_1782021/,Dual,Open Maze TDM,,my tag is 6570
8/17/2021 6:30:28,v,5469041,Rev,https://cdn.discordapp.com/attachments/433431402613309440/877136691188604948/unknown.png,Gunner Trapper,2TDM,Highest Arras Scores,Has only
8/17/2021 8:33:30,v,2245847,Mine,https://imgur.com/a/0dnfGgl,Auto Overseer,Open Maze TDM,Highest Arras Scores,
8/17/2021 9:01:30,v,2149360,Yusuf 100,https://imgur.com/a/cMGVaHz,Boomer,Squads-Duos,Highest Arras Scores,Yusuf 100#8706
8/17/2021 9:07:45,v,6749757,Zeo'Xe,https://imgur.com/a/sVgZHpd,Overlord,Portal 4TDM,Highest Arras Scores,
8/17/2021 10:42:51,v,1462591,Mine,https://cdn.discordapp.com/attachments/395646588682240020/877195273573662741/screenshot_-_2021-08-17T071146.297.png,Skimmer,Open Maze TDM,,
8/17/2021 11:14:53,v,4936258,hewo,https://imgur.com/a/4fK7fKu,Auto-Assassin,Portal 4TDM,Highest Arras Scores,TheChosenOne#4350
8/17/2021 15:02:14,v,2317059,// jAX,https://media.discordapp.net/attachments/826597893057150976/877265909570502657/screenshot_21.png?,Bulwark,FFA,Highest Arras Scores,"Trouble#3298 | Hi time to comment again (ik you love my comments, wr managers :)) ).  Anyways, ffa died soon after i hit 1m.  also, gg to zezo cus they know their shit.  ffa bulwark is op."
8/17/2021 16:12:29,v,4114739,Jazz,https://imgur.com/a/vT8eZOX,Auto Smasher,FFA,Highest Arras Scores,JZ#0020
8/17/2021 18:15:05,v,4680758,New Plan,https://imgur.com/a/VfY14nE,Auto-Assassin,4TDM,Highest Arras Scores,Cant#7643 #2 HAS auto-assassin:000?
8/17/2021 19:21:06,v,931113,cutie egirl,https://media.discordapp.net/attachments/794354649842188318/877330935786385448/Screen_Shot_2021-08-17_at_3.38.38_PM.png,Assassin,Open Maze TDM,,went on discord ffs
8/17/2021 19:36:39,x,4003713,jhose aka kys bt that tp lol,https://media.discordapp.net/attachments/849148753478549524/877334472519979048/unknown.png,Rocketeer,Open TDM,Highest Arras Scores,nigger kys
8/17/2021 22:04:57,x,250000,132,https://arras.io/,~~Other~~,Event (Legacy HAS only),,"Change my name to ""Noskill"""
8/17/2021 23:01:34,v,1216634,Soma White ღ,https://imgur.com/gallery/RkL29Kw,Skimmer,Maze 4TDM,,Soma White#4614
8/18/2021 0:16:03,v,3970006,Thing,https://media.discordapp.net/attachments/709618749250207745/877402077243011072/screenshot_-_2021-08-18T000146.399.png,Factory,Event (Legacy HAS only),,Legacy HAS Pls
8/18/2021 3:17:21,v,1761372,// jAX,https://photos.app.goo.gl/aRPzmv5gYvkPL7LS6,Factory,Open Maze TDM,,Trouble#3298
8/18/2021 4:03:03,v,1322849,raphael,https://imgur.com/a/80OzSrN,Mega Smasher,Open TDM,,
8/18/2021 6:53:49,v,4439765,Kei 🇯🇵,http://imgur.com/gallery/NzPcoJQ,Auto Tri-Angle,Open TDM,Highest Arras Scores,keeee#3898
8/18/2021 6:55:39,v,1649389,// jAX,https://photos.app.goo.gl/iGg3wprLMxKEKmTk6,Battleship,Maze 4TDM,,
8/18/2021 8:01:47,v,2403266,Mine,https://imgur.com/a/3VVWW6U,Spike,Open Maze TDM,Highest Arras Scores,
8/18/2021 13:20:46,v,3383633,engineering,https://imgur.com/a/0xPDJtX,Auto Gunner,Portal 4TDM,Highest Arras Scores,"havent played in a while, btw can some1 change wr name from engineering to  ""engineering"""
8/18/2021 14:40:21,x,1012489,⚡Balleя⚡,https://youtu.be/1popJIivwho,Ordnance,Portal 4TDM,Secondary Record,xSBallerSx #6273
8/18/2021 16:46:46,v,2371094,Panic,https://media.discordapp.net/attachments/395646588682240020/877654025120677928/screenshot_91.png?,Overseer,4TDM,Highest Arras Scores,fat cunt
8/18/2021 18:22:15,v,3724465,Chaos,https://imgur.com/a/87WXFd1,Ordnance,2TDM,Highest Arras Scores,"Hello, also something is wrong with the sheet, it says I have 16 when I have 17 so if you can fix that. : )"
8/18/2021 18:26:29,v,2817138,engineering,https://imgur.com/a/ZFV40VP,Conqueror,2TDM,Highest Arras Scores,engineering#0001
8/18/2021 20:26:29,v,1524093,amToast,https://imgur.com/a/Jfqlqf7,Sidewinder,2TDM,,worst tank ever
8/19/2021 5:01:41,v,2694105,Thx m8,https://cdn.discordapp.com/attachments/747714118118670378/877839134310412298/screenshot_-_2021-08-19T140831.522.png,Annihilator,FFA,Highest Arras Scores,HAS only.
8/19/2021 8:22:47,v,4687592,Mine,https://imgur.com/a/09vgNJ3,Artillery,2TDM,Highest Arras Scores,
8/19/2021 15:57:52,v,4257918,Heir,https://imgur.com/a/GCEzJHs,Manager,Squads-Duos,Highest Arras Scores,
8/19/2021 18:41:53,v,1115361,amToast,https://media.discordapp.net/attachments/395646588682240020/878045684132118538/screenshot_-_2021-08-19T174003.303.png,Crossbow,Maze 4TDM,,35/107 i think | gonna get taken in like a week idk
8/20/2021 5:13:41,v,2049896,Mine,https://imgur.com/a/3KCqJOH,Smasher,4TDM,Highest Arras Scores,HAS only
8/20/2021 5:21:49,x,1905519,TheMadLad,https://imgur.com/a/hW8cw8v,Assassin,4TDM,,i kept forgetting screenshots so i have some close to 500k and 1m 
8/20/2021 7:09:36,v,1593437,Mine,https://imgur.com/a/DVYHboy,Bomber,Open TDM,,
8/20/2021 9:24:42,x,3646037,timing,"blob:https://arras.io/3be7707f-5b91-4c52-9ce4-078ce61a04c4
blob:https://arras.io/574a5f78-1652-491e-9105-413883723e6a
blob:https://arras.io/6c84a10d-2092-4fbb-9b22-bdbb81886dab
blob:https://arras.io/49a0508c-6619-410c-8957-5587baf4df3c",Factory,Event (Legacy HAS only),Highest Arras Scores,LMAO
8/20/2021 9:38:43,v,1142556,Mine,https://cdn.discordapp.com/attachments/395646588682240020/878270631970496543/screenshot_-_2021-08-20T063311.297.png,Overgunner,Open Maze TDM,,
8/20/2021 12:39:00,v,1408690,Mine,https://imgur.com/a/MUJVLR6,Hunter,Open Maze TDM,,
8/20/2021 13:23:15,x,1466446,⚡Balleя⚡,https://youtu.be/1POkS0aI42g,Predator,4TDM,Highest Arras Scores,since they put the rules in Spanish or things like that ah and that the hunters are not nameless
8/20/2021 13:45:48,v,5358534,ByEkc,https://imgur.com/a/Oa347JF,Overdrive,4TDM,Highest Arras Scores,byekc#0027
8/20/2021 15:00:02,v,766537,KSK,https://imgur.com/gallery/Av1v08J,Battleship,Maze 2TDM,,KSK#6969
8/20/2021 19:01:50,v,1111789,KSK,https://imgur.com/gallery/mZdHQXT,Auto Tri-Angle,Maze 2TDM,,KSK#6969
8/20/2021 19:30:07,x,1793843,q=Q,https://imgur.com/gallery/2OEZWaS,Poacher,Maze 4TDM,Highest Arras Scores,3/11/4775
8/20/2021 21:44:15,x,1347565,PaNcAkE🥞,https://imgur.com/a/20A3c9X,Auto-Assassin,FFA,,
8/20/2021 23:24:39,x,1034684,Corrupt X,"blob:https://arras.io/97d3e862-b606-48c1-af43-17b89ad8afff
blob:https://arras.io/8bb80c44-cd0f-4e81-b938-212f47968b53",Builder,Squads-Duos,Secondary Record,
8/20/2021 23:27:39,v,2721146,bird,https://cdn.discordapp.com/attachments/878322803642867753/878479748710432879/unknown.png,Overseer,4TDM,Highest Arras Scores,bird#1809
8/20/2021 23:48:51,v,3614899,I REAL NOOB ( VN),https://imgur.com/gallery/CxYysWt,Twister,2TDM,Highest Arras Scores,Hùng#1111
8/21/2021 0:51:55,v,1088416,[K] Sirius,https://gall.dcinside.com/mgallery/board/view/?id=arrasio1&no=125&page=1,Cyclone,Open Maze TDM,,
8/21/2021 1:30:40,v,4936112,WL9,https://cdn.discordapp.com/attachments/790400452528963604/878510451095396412/screenshot_-_2021-08-21T012640.160.png,Factory,Event (Legacy HAS only),Highest Arras Scores,i'll get a 5m in siege someday.
8/21/2021 1:32:36,v,2743750,WL9,https://cdn.discordapp.com/attachments/787277183411290124/874797236859584592/screenshot_-_2021-08-10T140937.557.png,Factory,Event (Legacy HAS only),Highest Arras Scores,Old run I forgot to submit
8/21/2021 5:20:09,v,2058465,Majira???,https://cdn.discordapp.com/attachments/395646588682240020/878568240715018270/GG.png,Auto Overseer,Squads-Duos,Highest Arras Scores,yey wr
8/21/2021 5:49:05,v,3093598,bum,https://imgur.com/a/0wQ56SS,Overlord,4TDM,Highest Arras Scores,
8/21/2021 6:29:42,v,2941604,ASkib,https://imgur.com/a/sk1XpSX,Spreadshot,2TDM,Highest Arras Scores,ASkib#3333
8/21/2021 9:56:25,v,5760350,Awootube,https://imgur.com/a/F9hkQfn,Auto Overseer,4TDM,Highest Arras Scores,wtf peo
8/21/2021 10:41:04,x,1237603,Q~Fck Lag.,https://drive.google.com/file/d/1jfK7xc35SoaB8lYy0NBrTxD7o83-rflS/view?usp=sharing,Predator,Open TDM,Secondary Record,Guys it's been a while since I've posted my world records...It's been 3 months...It's been so long...And i finally got it. With 23 great 500k+ attempts with pred...I finally got a 1m pred...I'm like...Very pleased with this....I...I'm gonna...Screw it...I'm gonna go to bed after all those suffering..GoodNight.        ~Q.
8/21/2021 11:54:27,v,2641441,asd,https://imgur.com/a/HDKdkwT,Smasher,4TDM,Highest Arras Scores,
8/21/2021 12:00:57,v,2008175,Dog Of Wisdom,https://imgur.com/a/fo5NWuy,Factory,Event (Legacy HAS only),,Doggo
8/21/2021 12:44:31,v,2396656,For Kenza 🌹,https://imgur.com/a/kNnh636,Octo Tank,4TDM,Highest Arras Scores,Alissa#1237
8/21/2021 17:17:31,v,1280156,for a few dollars more,https://imgur.com/gallery/bZTuIX7,Minigun,Open Maze TDM,,tank 43
8/21/2021 18:31:12,v,3384736,The Almighty Pint,https://imgur.com/a/TjhC1RX,Auto-5,4TDM,Highest Arras Scores,
8/21/2021 19:46:05,v,1268525,amToast,https://imgur.com/a/9WSkUTy,Machine Gunner,Open Maze TDM,,gunr macin | imgur only cause i found a gem :D
8/21/2021 21:47:46,x,1074273,Plasma (timing),blob:https://arras.io/d64e2ec1-85ed-421b-952c-6e42dcd660c4,Streamliner,Squads-Duos,Secondary Record,Second Ster 1m!
8/21/2021 22:04:26,v,3099703,Awootube,https://imgur.com/a/w0isHl4,Auto Smasher,4TDM,Highest Arras Scores,clock wont reject no balls
8/21/2021 23:31:27,v,2176613,Quad,https://imgur.com/a/4R9ARW8,Overlord,FFA,Highest Arras Scores,
8/22/2021 3:34:13,v,1138780,Soma White ღ,https://imgur.com/gallery/MsA9T0o,Auto Tri-Angle,Maze 4TDM,,Soma White#4614
8/22/2021 4:10:14,x,1158711,how? (jpeg),https://media.discordapp.net/attachments/784392997030461460/878913415576432670/unknown.png?,Annihilator,Squads-Duos,,yehaw look the noob here (and it's maze squad)
8/22/2021 5:19:06,x,1000138,Q~Fck Lag.,https://drive.google.com/file/d/1WoNwvuVaLZY0CNlET4vXxHkpSE1f1Cev/view?usp=sharing,Sprayer,Maze,Secondary Record,4th mil grind!
8/22/2021 5:20:45,x,1054915,Q~Fck Lag.,https://drive.google.com/file/d/13X7xu7OhgjJcupDk5gjrZ5-MxDfyNKuF/view?usp=sharing,Triplet,Maze,Secondary Record,5TH mil grind!
8/22/2021 5:22:04,x,1064242,Q~Fck Lag.,https://drive.google.com/file/d/1PpIx0iUyE9AL_fAJyqaTK0xBgr8fNDmt/view?usp=sharing,Beekeeper,Maze,Secondary Record,6TH mil grind!
8/22/2021 11:45:24,v,4245728,Awootube,https://imgur.com/a/JZFM7zV,Auto Smasher,4TDM,Highest Arras Scores,"remove the last one, this is the full restored run. (clock no balls wont reject this either)"
8/22/2021 15:06:22,v,5712588,engineering,https://imgur.com/a/ocUFZKr,Overdrive,Portal 4TDM,Highest Arras Scores,bru 5 smashers
8/22/2021 15:16:33,v,3667739,Heir,https://cdn.discordapp.com/attachments/790400452528963604/879081271186292766/screenshot_-_2021-08-22T121500.080.png,Factory,Event (Legacy HAS only),,
8/22/2021 15:34:35,v,2049002,Heir,https://cdn.discordapp.com/attachments/557386978782609428/821089912954552340/screenshot_-_2021-03-15T113151.924.png,Destroyer,Event (Legacy HAS only),,
8/22/2021 17:22:45,x,1456737,PaNcAkE🥞,https://imgur.com/a/ZknxEKF,Auto Overseer,Event (Legacy HAS only),,
8/22/2021 18:32:22,v,2186744,Dr. Demise,https://photos.app.goo.gl/7YhVYQTAQYrs7CBF9,Hunter,Squads-Duos,Highest Arras Scores,"Trouble#3298 - can you change my name on the sheet to ""Dr. Demise""? thank you very much.  also thank you to catto for helping me with this 2m and for alas who restored me."
8/22/2021 18:39:00,v,1482940,New Plan,https://imgur.com/a/TxDiPtu,Auto Spawner,Squads-Duos,,Cant#7643
8/22/2021 19:43:15,v,2106316,Sexy Catto,https://imgur.com/a/60EWQHr,Factory,Event (Legacy HAS only),,Catto#0012
8/22/2021 21:02:16,v,2231354,PaNcAkE🥞,https://imgur.com/a/nfk1hWz,Factory,Event (Legacy HAS only),Highest Arras Scores,
8/22/2021 21:33:33,v,2514110,Moonlight,https://docs.google.com/presentation/d/15yYsnkSSfOGhosnDsJoVPiFtKdPWnM7ZOkL2lIdnUu4/edit?usp=sharing,Ordnance,2TDM,Highest Arras Scores,Moonlight#2618 4th 2 Million 1st on mobile :)
8/22/2021 23:25:38,v,1335940,Darky,https://imgur.com/a/nQRJSZR,Auto Tri-Angle,Maze 4TDM,,Just Dark?#8336
8/23/2021 2:54:38,v,1952542,you tried ☆,https://imgur.com/a/0ndWreu,Falcon,Maze 4TDM,,
8/23/2021 0:12:31,v,2425673,ASkib,https://media.discordapp.net/attachments/731494808475926531/879215683072835664/screenshot_22.png,Predator,Portal 4TDM,Highest Arras Scores,
8/23/2021 5:55:26,v,3158599,KSK,https://imgur.com/gallery/u6yBRbO,Ordnance,4TDM,Highest Arras Scores,KSK#6969
8/23/2021 6:32:06,v,3656191,From Asia,https://imgur.com/a/JbZcld5,Auto-Assassin,Squads-Duos,Highest Arras Scores,FromAsia#7568
8/23/2021 12:40:14,x,2073821,BIG BOY,https://arras.io/#ob,Octo Tank,Maze,,
8/23/2021 17:36:12,v,1334976,amToast,https://media.discordapp.net/attachments/395646588682240020/879478417601495070/screenshot_-_2021-08-23T163313.450.png,Ranger,Maze 4TDM,,ranger r34
8/23/2021 22:30:29,v,1413801,Darky,https://imgur.com/a/idcfILB,Mega Smasher,Open TDM,,Just Dark?#8336
8/24/2021 2:49:06,v,2566483,KSK,https://imgur.com/gallery/m5HY4he,Auto-Assassin,Open TDM,Highest Arras Scores,KSK#6969
8/24/2021 3:17:24,v,1511957,Mythical 2.0,https://imgur.com/a/bEzyMlu,Auto Cruiser,FFA,,"well, i know that someone is already named ""Mythical"", but my identity is mythical, so i will just write a ""2.0"" after it"
8/24/2021 3:30:53,v,3511835,Darky,https://imgur.com/a/Rco8dij,Smasher,4TDM,Highest Arras Scores,Just Dark?#8336
8/24/2021 4:40:53,v,3072803,[a letter a],https://www.reddit.com/r/Diep2io/comments/pajavo/3m_musket_wr/?utm_source=share&utm_medium=web2x&context=3,Musket,Squads-Duos,Highest Arras Scores,also can u change my sheet name to a letter a?
8/24/2021 7:30:03,v,2039739,nata,https://imgur.com/a/4mtWcfy,Overlord,FFA,Highest Arras Scores,eggman nega
8/24/2021 11:52:48,v,2761990,siege guantlet,https://imgur.com/a/m6LB3nD,Factory,Event (Legacy HAS only),,"i died on round 23, like an absolute clown"
8/24/2021 12:14:01,x,1725670,Cotisgud,https://media.discordapp.net/attachments/874677490449268856/879751837237006346/unknown.png?,Battleship,2TDM,,Cotisgud#7895
8/24/2021 12:24:54,x,1419187,⚡Balleя⚡,https://youtu.be/302ENCgOqao,Predator,4TDM,Highest Arras Scores,Well I got caught by two overssers and an octo tank
8/24/2021 14:28:21,x,1070596,⚡Balleя⚡,https://youtu.be/yBTDS36bfHA,Predator,4TDM,Highest Arras Scores,today I showed off with 2WR in a single day
8/24/2021 16:10:20,x,250000,Moonlight(Read Details),http,~~Other~~,Event (Legacy HAS only),,For the highest farmed score secondary record are we allowed to have kills?
8/24/2021 20:59:44,v,2006128,Rev,https://cdn.discordapp.com/attachments/866890462555144232/879687865884348446/screenshot_54.png,Auto Smasher,4TDM,Highest Arras Scores,HAS only
8/24/2021 22:40:09,v,1960074,baking soda,https://imgur.com/gallery/PEl2hxG,Banshee,Maze,,
8/24/2021 23:09:41,v,5083845,Onyx,https://imgur.com/gallery/6S2dTda,Armsman,Squads-Duos,Highest Arras Scores,tank 44
8/25/2021 0:37:57,v,2399823,Rev,https://cdn.discordapp.com/attachments/731494808475926531/879946993923940403/screenshot_22.png,Annihilator,Event (Legacy HAS only),Highest Arras Scores,Legacy HAS only
8/25/2021 2:12:18,v,2868085,Majira???,https://media.discordapp.net/attachments/395646588682240020/879970733768454195/screenshot_26.png,Mega Smasher,2TDM,Highest Arras Scores,"lmao, I'll fucking do it again"
8/25/2021 2:16:09,x,250000,132,https://arras.io/,~~Other~~,Event (Legacy HAS only),,"Please remove all my wrs ,and ban me from wr sheet ,thanks you guys.These 5m(s) has given me a lot of psychological stress when someone mention them."
8/25/2021 8:43:38,v,1731286,Stardust,https://imgur.com/gallery/9HZk1fr,Spreadshot,Maze 2TDM,,ok
8/25/2021 12:08:02,v,3521009,Mine,https://imgur.com/a/KakASlQ,Predator,Open Maze TDM,Highest Arras Scores,
8/25/2021 14:01:45,v,2755711,NeonLights,https://imgur.com/a/wyoqlRa,Predator,Open Maze TDM,Highest Arras Scores,
8/25/2021 18:39:21,v,1589780,Mine,https://imgur.com/a/xJwWeZG,Beekeeper,Open Maze TDM,,
8/25/2021 19:28:46,x,1126219,⚡Balleя⚡,https://imgur.com/gallery/RCGBep9,Ordnance,Portal 4TDM,Secondary Record,
8/25/2021 21:15:17,x,1092168,[K] Sirius,https://gall.dcinside.com/mgallery/board/view/?id=arrasio1&no=146&page=1,Overgunner,Open Maze TDM,,
8/25/2021 23:22:13,v,979701,you tried ☆,https://imgur.com/a/NvfW66O,Auto Cruiser,Maze 4TDM,,
8/26/2021 0:37:06,v,1607868,you tried ☆,https://imgur.com/a/sF6MHok,Landmine,Open Maze TDM,,
8/26/2021 2:28:03,v,2243212,KSK,https://imgur.com/gallery/b9rhnhC,Ordnance,2TDM,Highest Arras Scores,KSK#9351
8/26/2021 3:30:27,v,2276849,Darky,https://imgur.com/a/Cepmv5u,Smasher,4TDM,Highest Arras Scores,Just Dark?#8336
8/26/2021 4:31:37,x,1994884,Over∆scension,http://imgur.com/gallery/NEFGmXe,Auto Overseer,Squads-Duos,,OverAscension#6704
8/26/2021 6:03:31,v,2311132,ASkib,https://media.discordapp.net/attachments/731498658276835398/879697751863091200/screenshot_30.png,Gunner Trapper,4TDM,Highest Arras Scores,
8/26/2021 6:07:14,v,1951097,hewo,https://imgur.com/a/xhp4iuK,Commander,Portal 4TDM,,
8/26/2021 9:32:19,v,2042449,siege gauntlet,https://ibb.co/YWJDHbr,Factory,Event (Legacy HAS only),,elite sprayer is fair
8/26/2021 10:02:45,v,2075134,Sexy Catto,https://imgur.com/a/0bPXn3K,Ordnance,Event (Legacy HAS only),,Catto#0012
8/26/2021 22:16:07,v,2668685,toad,https://imgur.com/a/a8Hn0jt,Smasher,4TDM,Highest Arras Scores,
8/27/2021 3:43:03,v,1559097,raphael,https://imgur.com/a/iqBfhoF,Auto Smasher,Open Maze TDM,,
8/27/2021 6:38:16,v,2151273,Core From SYD,https://imgur.com/gallery/DevpZFo,Rocketeer,Squads-Duos,Highest Arras Scores,
8/27/2021 9:37:14,v,2459256,₮ⱤɄ₵ɆⱤ⚡️,https://imgur.com/a/zN8VrJI,Machine Gunner,2TDM,Highest Arras Scores,
8/27/2021 10:48:36,v,2171587,Hertz,https://imgur.com/a/p48Q4tO,Tri-Angle,4TDM,Highest Arras Scores,
8/27/2021 12:27:29,v,2004580,je7,https://imgur.com/a/4f4xNNB,Auto Smasher,4TDM,Highest Arras Scores,
8/27/2021 13:55:14,v,3701537,For Kenza 🌹,https://imgur.com/a/m2Jy0Be,Manager,Portal 4TDM,Highest Arras Scores,Alissa#1237
8/27/2021 14:00:30,v,1796469,For Kenza 🌹,https://imgur.com/a/m0ehKVT,Launcher,4TDM,,Alissa#1237
8/27/2021 18:32:44,x,1802436,PaNcAkE🥞,https://imgur.com/a/GNpK9ks,Overseer,4TDM,,
8/27/2021 18:41:18,v,3110574,Mine,https://imgur.com/a/nW2VRhS,Auto-Assassin,2TDM,Highest Arras Scores,
8/27/2021 18:54:21,v,2456778,Awootube,https://imgur.com/a/aIza263,Spike,Squads-Duos,Highest Arras Scores,there were like 15 spikes in the server and a hunter that literally went for me for like 30 minutes :cringe:
8/27/2021 20:40:35,x,2604575,FaLleN,https://imgur.com/gallery/tNXh5o5,Triple Twin,2TDM,Highest Arras Scores,
8/27/2021 20:53:41,x,2097780,69,https://imgur.com/a/RSwdxQO,Mega Smasher,Open Maze TDM,Highest Arras Scores,
8/27/2021 21:40:38,v,1031835,Giggity,https://imgur.com/a/o7Q0IW6,Hexa Trapper,Open Maze TDM,,Giggity#8267 (Remove spike trick goddammit)
8/27/2021 21:42:49,v,2122762,Kei 🇯🇵,http://imgur.com/gallery/3WHJ8Cp,Twister,Squads-Duos,Highest Arras Scores,keeee#3898
8/27/2021 22:28:10,v,6124339,Onyx,https://imgur.com/gallery/4xgvAXo,Auto Overseer,2TDM,Highest Arras Scores,i beat my pb by 8k!
8/27/2021 23:03:06,x,2000000,Leah Gotti,https,Musket,4TDM,Highest Arras Scores,Tushy First Anal For Brunette Leah Gotti
8/27/2021 23:09:02,x,3000000,Brazzers,https,Auto Spawner,FFA,Highest Arras Scores,Brazzers
8/27/2021 23:09:37,v,2097780,69,https://imgur.com/a/RSwdxQO,Mega Smasher,Open Maze TDM,,
8/27/2021 23:11:49,x,2000000,MA PP,https,Auto Double,Open TDM,Highest Arras Scores,YES
8/27/2021 23:13:31,x,3000000,ma dick big,https,Auto Builder,4TDM,Highest Arras Scores,ma dick big#6969
8/28/2021 0:59:46,v,1242894,[K] Sirius,https://gall.dcinside.com/mgallery/board/view/?id=arrasio1&no=154&page=1,Overgunner,Open Maze TDM,,
8/28/2021 4:06:17,x,2097780,69,https://imgur.com/a/RlXWodj,Mega Smasher,Open Maze TDM,Highest Arras Scores,
8/28/2021 4:55:42,x,2097780,69,https://imgur.com/a/RSwdxQO,Mega Smasher,Open Maze TDM,Highest Arras Scores,
8/28/2021 4:58:36,x,1536670,shuna,https://cdn.discordapp.com/attachments/849539724246253577/881099420379263016/screenshot_100.png,Auto Cruiser,FFA,,
8/28/2021 5:32:56,x,2236362,YT=GLITCHER TM,https://imgur.com/a/TdXToOI,Octo Tank,Maze,Highest Arras Scores,GLITCHER TM#5441
8/28/2021 8:16:15,x,1536670,shuna,https://cdn.discordapp.com/attachments/849539724246253577/881099420379263016/screenshot_100.png,Auto Cruiser,FFA,,
8/28/2021 11:14:00,x,2026369,Mzah,http://imgur.com/gallery/cahmoOQ,Auto Tri-Angle,2TDM,Highest Arras Scores,mzah#0926
8/28/2021 11:56:10,v,2587026,Smiley,https://imgur.com/a/m973PDN,Double Twin,Maze 4TDM,Highest Arras Scores,wr+has
8/28/2021 13:45:48,v,1352794,…Alli0tiS…,https://media.discordapp.net/attachments/870772520721186877/881231717820678164/unknown_2021.08.28-18.25.png,Skimmer,Maze 4TDM,,…KILLER…#4543
8/28/2021 13:47:40,v,1299851,…Alli0tiS…,https://media.discordapp.net/attachments/870772520721186877/881233284611342406/unknown_2021.png,Twister,Maze 4TDM,,…KILLER…#4543
8/28/2021 16:02:04,x,1127939,⚡Balleя⚡,https://imgur.com/gallery/powc8oo,Predator,Portal 4TDM,Secondary Record,Please in the rules also put Spanish
8/28/2021 16:03:57,x,1384349,⚡Balleя⚡,https://imgur.com/gallery/JXnyfhv,Ordnance,Portal 4TDM,Secondary Record,:3
8/28/2021 20:19:24,v,2378772,Beyo,https://imgur.com/a/AS76gNS,Mega Smasher,4TDM,Highest Arras Scores,
8/29/2021 3:42:26,v,1622252,Mine,https://imgur.com/a/eWm6uZw,Auto-Assassin,Open Maze TDM,,
8/29/2021 3:44:13,v,2709215,Rev,https://cdn.discordapp.com/attachments/866890462555144232/881443327382282300/screenshot_9.png,Stalker,2TDM,Highest Arras Scores,HAS Only
8/29/2021 4:40:40,v,1341987,Hertz,https://imgur.com/a/IwQc9C3,Mega Smasher,Maze,,
8/29/2021 6:05:48,x,2097780,69,https://imgur.com/a/f3qJSwh,Mega Smasher,Open Maze TDM,Highest Arras Scores,
8/29/2021 7:32:45,v,2589533,loaf,https://imgur.com/a/0TzZlNz,Mortar,Open Maze TDM,Highest Arras Scores,spoon
8/29/2021 7:42:20,x,1066372,⚡Balleя⚡,https://imgur.com/gallery/Y4Gx4nr,Predator,2TDM,Secondary Record,Hybrid surprise = Pathetic
8/29/2021 7:44:54,x,1017580,⚡Balleя⚡,https://imgur.com/gallery/rcAqGpm,Predator,4TDM,Secondary Record,Serpents Hand is admin
8/29/2021 8:21:11,v,3732812,noscore,https://media.discordapp.net/attachments/731498658276835398/881496907216740422/unknown.png,Manager,2TDM,Highest Arras Scores,
8/29/2021 8:29:01,v,2565264,ASkib ,https://imgur.com/a/2vDdrfK,Fortress,2TDM,Highest Arras Scores,
8/29/2021 9:10:23,v,3178385,From Asia,https://imgur.com/a/uuDlFaM,Hunter,Open TDM,Highest Arras Scores,FromAsia#7568
8/29/2021 9:13:45,v,2418682,From Asia,https://cdn.discordapp.com/attachments/853595780795465728/881526882158387280/screenshot_7.png,Manager,Portal 4TDM,Highest Arras Scores,
8/29/2021 9:30:59,x,1191026,[Mk9]   Xenom  SpX,https://imgur.com/a/c3FP830,Auto Spawner,2TDM,Highest Arras Scores,XenomARRS#6741
8/29/2021 9:37:35,x,1191026,[Mk9]    Xenom  SpX,https://imgur.com/a/c3FP830,Auto Smasher,2TDM,Highest Arras Scores,XenomARRS#6741
8/29/2021 12:24:02,v,2013000,Smiley,https://cdn.discordapp.com/attachments/811691694231781386/881574391757041714/unknown.png,Eagle,4TDM,Highest Arras Scores,has only
8/29/2021 14:20:45,v,1312063,8,https://imgur.com/a/EGKbDB5,Stalker,Maze,,
8/29/2021 15:22:26,v,2502429,New Plan,https://imgur.com/a/dvTcPpc,Auto Spawner,Squads-Duos,Highest Arras Scores,Cant#7643
8/29/2021 23:28:38,v,1866208,deepfreeze,https://imgur.com/a/vOYmmje,Trap Guard,Open Maze TDM,,dad?#6595 | new personal best :D
8/30/2021 0:16:17,v,2059323,cutie egirl,https://imgur.com/a/Bsxufut,Assassin,Open TDM,Highest Arras Scores,carrot op
8/30/2021 2:31:09,v,3017610,Pain痛み,https://imgur.com/gallery/q5xSwPi,Factory,4TDM,Highest Arras Scores,Pain痛み#9372
8/30/2021 9:25:38,v,4193541,Awootube,https://media.discordapp.net/attachments/395646588682240020/881891127987425380/4m_pred.png?,Predator,4TDM,Highest Arras Scores,thanks for feeding me smasher ---> spike hunters
8/30/2021 11:15:20,v,2095150,Onyx,https://imgur.com/gallery/6SS9sLY,Auto-Assassin,4TDM,Highest Arras Scores,solo 2m for has
8/30/2021 11:20:42,v,2331426,Onyx,https://imgur.com/gallery/nWapTsn,Auto Double,FFA,Highest Arras Scores,yAy ffa 2m for has
8/30/2021 16:16:42,v,1476276,amToast,https://media.discordapp.net/attachments/880264521946652712/881995390319214612/screenshot_44.png,Auto-5,Open TDM,,lmao
8/30/2021 16:34:57,v,2218937,Thing,https://media.discordapp.net/attachments/845113751258660894/881999407858458695/screenshot_-_2021-08-30T100934.895.png,Overlord,4TDM,Highest Arras Scores,
8/30/2021 17:14:13,x,3131313,Uggogguarth,https://imgur.com/a/l0CUVQt,Single,Open Maze TDM,,change my sheet name to Uggogguarth
8/30/2021 18:30:53,x,1223870,PaNcAkE🥞,https://imgur.com/a/yG8joSW,Necromancer,2TDM,,"pls help dev, i cant escape this 400 ms pain :("
8/30/2021 18:58:17,v,4880712,Thing,https://media.discordapp.net/attachments/866023322529955870/882035463446200390/screenshot_-_2021-08-30T184342.788.png,Rocketeer,Event (Legacy HAS only),Secondary Record,highest poopy assault score
8/30/2021 19:54:44,v,3071885,│DηB│,https://imgur.com/a/3fuSpCd,Auto Overseer,Portal 4TDM,Highest Arras Scores,
8/30/2021 19:57:33,v,2534970,│DηB│,https://imgur.com/a/BSynRX6,Annihilator,Maze,Highest Arras Scores,
8/31/2021 1:07:14,x,3387039,Jormungander,https://www.youtube.com/watch?v=B8TfSW07Jms,Overdrive,Open TDM,Highest Arras Scores,Jörmungander#0641
8/31/2021 2:57:16,v,2985085,levi,https://imgur.com/a/63OFH5k,Ordnance,4TDM,Highest Arras Scores,obsess#1605
8/31/2021 3:49:49,x,1536670,shuna,https://cdn.discordapp.com/attachments/875326208865345557/881099076416987156/screenshot_-_2021-08-28T174813.499.png,Auto Cruiser,FFA,,
8/31/2021 4:53:09,v,1168357,Mine,https://imgur.com/a/z08iTni,Assassin,Open Maze TDM,,
8/31/2021 4:56:36,v,2097280,Mine,https://imgur.com/a/AUw1BHE,Overdrive,Open Maze TDM,Highest Arras Scores,
8/31/2021 5:10:47,v,2058265, 🌷|retnuH,https://imgur.com/gallery/nJLXYH3,Twister,Maze,,
8/31/2021 9:44:33,x,1020385,⚡Balleя⚡,https://imgur.com/gallery/om5w64K,Overlord,Squads-Duos,Secondary Record,Sorry I did not photograph my death because it was more but I reached the million
8/31/2021 10:09:02,v,2039053,<❂> 𝓪𝓵𝓲۷𝓮🌹,https://imgur.com/a/lLyc6t1,Auto Tri-Angle,2TDM,Highest Arras Scores,<❂> 𝓪𝓵𝓲۷𝓮🌹#1628
8/31/2021 11:47:30,x,1120252,⚡Balleя⚡,https://imgur.com/gallery/IkhgOAA,Auto Overseer,Squads-Duos,Secondary Record,make your tank the most balanced not only in damage but also in protection The reason for my death was the speed of making drones
8/31/2021 13:08:04,v,1188611, 🌷|retnuH ,https://imgur.com/gallery/m5aK1sW,Commander,Maze 2TDM,,
8/31/2021 13:18:40,v,2058265,🌷|retnuH ,https://imgur.com/gallery/nJLXYH3,Twister,Maze,Highest Arras Scores,
8/31/2021 15:21:53,x,1258155,⚡Balleя⚡,https://imgur.com/gallery/kGKteT3,Ordnance,Maze 4TDM,,I swear that anni was a hacker .I kill myself crossing a wall and it is not dev
8/31/2021 17:22:44,v,2968450,Sonder,https://media.discordapp.net/attachments/866023322529955870/882039640075403295/screenshot_-_2021-08-30T185124.425.png,Nailgun,Event (Legacy HAS only),Highest Arras Scores,
8/31/2021 17:23:13,v,2011408,Sonder,https://media.discordapp.net/attachments/866023322529955870/882374258515410984/screenshot_-_2021-08-31T171939.429.png,Octo Tank,4TDM,Highest Arras Scores,
8/31/2021 18:35:21,v,2717576,siege gauntlet,https://ibb.co/GCcNQrc,Factory,Event (Legacy HAS only),,siege gauntlet
8/31/2021 19:46:37,x,9999999,asd,https://imgur.com/a/C6Xf9kx,Overtrapper,Maze,,change my sheet name back to asd
8/31/2021 21:05:24,x,1410900,Soma White ღ,https://imgur.com/gallery/sYI44fw/comment/2126552865,Hexa Trapper,2TDM,,Soma White#4614
8/31/2021 21:17:36,v,2534092,Soma White ღ,https://imgur.com/gallery/NH1TbQo,Hexa Trapper,4TDM,Highest Arras Scores,Soma White#4614
8/31/2021 21:27:02,x,271642,⚡Balleя⚡,https://imgur.com/gallery/5PDhFRC,Auto Overseer,Event (Legacy HAS only),Highest Arras Scores,Dumb death xd
8/31/2021 21:37:00,v,2716642,⚡Balleя⚡,https://imgur.com/gallery/5PDhFRC,Auto Overseer,Event (Legacy HAS only),Highest Arras Scores,death dumb xd
8/31/2021 23:37:20,v,4928405,ASkib,https://imgur.com/a/Kp5WODb,Auto-Assassin,2TDM,Highest Arras Scores,
9/1/2021 3:35:33,v,6307262,Thx m8,https://imgur.com/a/gA8MviK,Smasher,Maze 4TDM,Highest Arras Scores,World Record for Smasher Maze 4tdm .
9/1/2021 3:44:04,v,1119056,a letter a,https://www.reddit.com/r/Diep2io/comments/pfp1w4/11m_carrier_wr/?utm_source=share&utm_medium=web2x&context=3,Carrier,Maze 4TDM,,shouldnt have i died if not becuse of that octo
9/1/2021 11:57:33,v,4595640,Chaos,https://imgur.com/a/sWIaoAk,Crop Duster,2TDM,Highest Arras Scores,It says on the sheet that I only have 17 wr when I actually have 18. The one wr that is wrong is my 3 million auto gunner so fix that cause it makes separated from mine
9/1/2021 12:02:56,v,2252464,Darky,https://imgur.com/a/u20JneT,Surfer,Maze 4TDM,Highest Arras Scores,Just Dark?#8336
9/1/2021 12:07:31,x,1689731,poui,https://discord.com/channels/731494808475926528/731498658276835398/882644610076274708,Hexa Trapper,Maze,,poui#2675
9/1/2021 14:30:39,v,2464919,₮ⱤɄ₵ɆⱤ⚡️,https://imgur.com/a/3fO5xiP,Overlord,FFA,Highest Arras Scores,Has only
9/1/2021 15:56:29,v,2073867,For Kenza 🌹,https://imgur.com/a/hU3f9Lk,Crossbow,2TDM,Highest Arras Scores,Alissa#1237
9/1/2021 16:00:04,v,2453140,For Kenza 🌹,https://imgur.com/a/wYWvoF7,Destroyer,Maze 4TDM,Highest Arras Scores,Alissa#1237
9/1/2021 16:32:49,v,2005882,Chaos,https://imgur.com/a/ZW1tLg6,Destroyer,Maze,Highest Arras Scores,HAS only ( Maze hell)
9/1/2021 21:17:02,v,1374206,⚡Balleя⚡,https://imgur.com/gallery/6vXyod0,Auto Overseer,Maze 4TDM,Secondary Record,
9/1/2021 21:20:55,v,1047737,⚡Balleя⚡,https://imgur.com/gallery/ui5rDHB,Auto Overseer,Maze 4TDM,Secondary Record,Fuck baby tank 
9/1/2021 21:28:28,v,1479501,⚡Balleя⚡,https://imgur.com/gallery/TgGyxgj,Ordnance,Maze 4TDM,Highest Arras Scores,Sick hunter you can kill me after 50k because you couldn't hold on
9/1/2021 22:10:09,v,2423595,raphael,https://imgur.com/a/aIiVmj6,Triple Twin,Portal 4TDM,,
9/1/2021 23:23:52,v,2045490,Darky,https://imgur.com/a/YswtEp4,Mega Smasher,Portal 4TDM,Highest Arras Scores,Just Dark?#8336
9/1/2021 23:28:54,v,2563209,ASkib,https://imgur.com/a/9YkWNW0,Mega Smasher,Portal 4TDM,Highest Arras Scores,
9/2/2021 0:46:22,v,2135353,Mine,https://imgur.com/a/vPTDjyr,Landmine,Squads-Duos,Highest Arras Scores,
9/2/2021 1:16:16,x,2423595,raphael,https://imgur.com/a/aIiVmj6,Triple Twin,Portal 4TDM,Highest Arras Scores,
9/2/2021 1:37:50,v,2039276,ASkib,https://media.discordapp.net/attachments/731498658276835398/882844397648109568/unknown.png,Poacher,FFA,Highest Arras Scores,
9/2/2021 10:45:34,v,2216886,Darky,https://imgur.com/a/C2I0mHg,Mega Smasher,Maze,Highest Arras Scores,Just Dark?#8336
9/2/2021 13:54:32,v,1777351,amToast,https://imgur.com/a/4YKPm6r,Auto Tri-Angle,2TDM,,is dc; submitting it cause why not (plus i can restore later)
9/2/2021 13:57:44,v,3005212,bird,https://imgur.com/a/SvG9cIb,Auto Overseer,Squads-Duos,Highest Arras Scores,bird#1809
9/2/2021 13:59:01,v,1547525,amToast,https://imgur.com/a/F9lgM17,Engineer,Maze 2TDM,,another one | server kinda dead but 8+ sort of
9/2/2021 14:15:56,x,1046353,You guys abuse beta tester too much smh.,https://imgur.com/a/hsYn9Zg,Builder,4TDM,,You guys abuse beta tester too much smh.
9/2/2021 15:25:28,x,696969,cry about it, https://arras.io,Mega Smasher,4TDM,Secondary Record,
9/2/2021 17:26:29,v,3177193,Heir,https://cdn.discordapp.com/attachments/557386978782609428/883100524335988748/screenshot_-_2021-09-02T142508.530.png,Annihilator,4TDM,Highest Arras Scores,
9/2/2021 19:52:49,v,2338498,Chaos,https://imgur.com/a/bIvYYfb,Destroyer,Maze,Highest Arras Scores,HAS only ( Also can you change my sheet name to Cнασѕ :∂
9/2/2021 20:40:35,v,1418894,bird,https://imgur.com/a/1nsoc1D,Auto Tri-Angle,Squads-Duos,,bird#1809
9/2/2021 22:08:51,v,755864,[K] Sirius,https://gall.dcinside.com/mgallery/board/view/?id=arrasio1&no=200&page=1,Bomber,Maze 2TDM,,
9/2/2021 22:19:00,v,2145992,raphael,https://imgur.com/a/DzCMg8v,Triple Twin,4TDM,Highest Arras Scores,
9/3/2021 2:24:59,v,2875172,Darky,https://imgur.com/a/ddDKB67,Smasher,Maze 2TDM,Highest Arras Scores,Just Dark?#8336
9/3/2021 6:15:51,v,1801676,ASkib,https://imgur.com/a/RfNd48B,Fighter,Squads-Duos,,
9/3/2021 10:10:38,x,573606,no name,https://imgur.com/a/m2gleLo,Penta Shot,4TDM,Secondary Record,
9/3/2021 10:32:34,v,282960,asd,https://cdn.discordapp.com/attachments/395646588682240020/883357453947895848/screenshot_-_2021-09-03T172724.165.png,(Basic) Tank,2TDM,Secondary Record,highest score without stats
9/3/2021 11:22:15,v,1639578,loaf,https://imgur.com/a/kntvcCT,Beekeeper,Open Maze TDM,,
9/3/2021 14:01:15,x,3270516,chip eater,https://imgur.com/a/wnLVvvH,Cyclone,Event (Legacy HAS only),,highest farmed score (non mothership)
9/3/2021 14:29:23,v,3507520,amToast,https://imgur.com/a/XXbkxk6,Auto Tri-Angle,2TDM,Highest Arras Scores,bread soda
9/3/2021 21:12:48,v,2718001,Dr. Demise,https://media.discordapp.net/attachments/827563414867017734/883519681963642900/screenshot_1.png?,Bushwhacker,Open TDM,Highest Arras Scores,Trouble#3298
9/3/2021 21:24:32,v,2839993,Dr. Demise,https://media.discordapp.net/attachments/879829286121537556/883501868574208030/screenshot_69.png?,Smasher,2TDM,Highest Arras Scores,"Trouble#3298 - rog said i am restore banned for 2 months so this is the latest ss of the run.  i figured that i'd submit since Myst's bulwark 2tdm death screen is a dc screen.  Apparently force dcs aren't acceptable, i mean i don't get it tbh.  i can understand if you are about to die and you dc, but i mean i was at base."
9/3/2021 21:47:27,x,2500000,Gibblet,https://i.redd.it/e7pm47tx4u151.png,Annihilator,Maze,Highest Arras Scores,dont have discord
9/3/2021 22:12:50,v,2510908,Gibblet,https://i.redd.it/e7pm47tx4u151.png,Annihilator,Maze 4TDM,Highest Arras Scores,don't have discord
9/4/2021 6:21:09,v,553503,For Kenza 🌹,https://imgur.com/a/BLo0knh,Rocketeer,2TDM,,Alissa#1237
9/4/2021 9:06:55,v,2708476,Dr. Demise,https://media.discordapp.net/attachments/826597893057150976/849872156124774410/screenshot_39.png,Sniper,Open TDM,Highest Arras Scores,Trouble#3298 - this run was 3 months ago but i was wondering if this can go back into the HAS sheet. This wr was removed originally because the open tdm gamemodes got combined 
9/4/2021 9:21:24,v,6461922,ByEkc,https://imgur.com/a/pzIYtDP,Overdrive,2TDM,Highest Arras Scores,byekc#0027
9/4/2021 16:37:44,v,2140284,xentria,https://imgur.com/a/dtUEXyp,Engineer,Squads-Duos,Highest Arras Scores,"First 1.4m, discord is Xentria#2503"
9/4/2021 18:10:06,v,2442566,Onyx,https://imgur.com/gallery/h18Egcl,Twister,Squads-Duos,Highest Arras Scores,put this for fastest tdm 2m: proof is in the imgur
9/4/2021 19:13:39,v,7130429,asd,https://imgur.com/gallery/Ip86Nys,Auto Smasher,2TDM,Highest Arras Scores,vangu fat
9/4/2021 20:55:14,v,1376943,Awootube,https://imgur.com/a/4JcnINi,Rocketeer,Squads-Duos,,"i sacrificed my exact 2m average for senior player, ik that the record will be taken quick "
9/5/2021 0:07:58,v,2146287,DucDuy,https://imgur.com/a/519x6Dn,Sidewinder,Portal 4TDM,Highest Arras Scores,ducduy#5849
9/5/2021 0:38:45,x,671584,no nae,https://imgur.com/pPILuJl,Auto Smasher,4TDM,Secondary Record,https://arras.io/#hb1380
9/5/2021 1:02:41,x,584032,no nae,https://imgur.com/aELYEei,Auto-5,4TDM,Secondary Record,https://arras.io/#hb1380
9/5/2021 1:35:37,x,1079990,edamameといふ人,https://imgur.com/a/HrEFYdc,Cyclone,FFA,,edamame#8632(discord)
9/5/2021 3:58:55,v,2503065,Thx m8,https://imgur.com/a/m1wj6Da,Overseer,2TDM,Highest Arras Scores,HAS only.
9/5/2021 4:41:49,x,530415,no nae,https://imgur.com/pQRYe0f,Ranger,Open TDM,Secondary Record,https://arras.io/#vc3993
9/5/2021 6:52:29,x,1511281,edamameといふ人,https://imgur.com/a/MYVwHvB,Cyclone,FFA,Highest Arras Scores,high score...!!
9/5/2021 9:03:17,x,294472,Harv,https://imgur.com/a/MLI4S8o,Rocketeer,Open TDM,,
9/5/2021 9:35:25,v,1708784,Stardust,https://imgur.com/gallery/UYMYbco,Predator,Maze,,
9/5/2021 9:44:17,v,1558365,₮ⱤɄ₵ɆⱤ⚡️,https://imgur.com/a/KqRrOzH,Maleficitor,Maze 2TDM,,sorry Heir 
9/5/2021 11:06:31,v,1978525,For Kenza 🌹,https://imgur.com/gallery/Paj5pc3,Engineer,2TDM,,Alissa#1237
9/5/2021 16:05:06,x,6065417,FrankTheFish,https://imgur.com/a/CDcayCI,Maleficitor,FFA,Highest Arras Scores,60654174208 actual score wont let me type that out though.
9/5/2021 17:48:25,x,2031006,LegenDx,https://imgur.com/a/1KXZq7a,Rocketeer,FFA,Highest Arras Scores,what is a secondary record?
9/6/2021 1:47:45,v,1541173,jsohi,https://imgur.com/gallery/35sC3yb,Gunner,Portal 4TDM,,not sure why 2 mega 3 bullets can 1 shot you but ok that was my mistake there
9/6/2021 2:33:27,v,2108930,a letter a,https://imgur.com/a/9FFkFiQ,Skimmer,Open Maze TDM,Highest Arras Scores,hard server
9/6/2021 2:51:58,v,1156793,Raptor,https://imgur.com/a/zkBAI7C,Tri-Angle,Portal 4TDM,,Fallen Wingston#5349
9/6/2021 3:01:40,v,1789746,Raptor,https://imgur.com/a/ZSCPucm,Predator,Maze 2TDM,,Fallen Wingston#5349
9/6/2021 3:23:37,v,3187058,Bowler,https://imgur.com/gallery/oCUZIqr,Hunter,Squads-Duos,Highest Arras Scores,Bowler = fat boy
9/6/2021 3:24:34,v,2868533,Bowler,https://imgur.com/gallery/pJgWyhw,Poacher,4TDM,Highest Arras Scores,
9/6/2021 3:25:21,v,3969833,Bowler,https://imgur.com/gallery/UpqYytD,Overlord,Squads-Duos,Highest Arras Scores,
9/6/2021 3:26:09,v,2030770,Bowler,https://imgur.com/gallery/zlmNInr,Destroyer,Squads-Duos,Highest Arras Scores,
9/6/2021 4:35:09,v,2195911,Mine,https://imgur.com/a/s8b8rSP,Constructor,Open Maze TDM,Highest Arras Scores,
9/6/2021 6:04:44,v,4329345,殴るしかない顔面,https://imgur.com/a/BzJfOhu,Twister,FFA,Highest Arras Scores,
9/6/2021 12:38:38,x,2608963,For Kenza 🌹,https://imgur.com/gallery/0Ck2a6e,Penta Shot,Maze,Highest Arras Scores,Alissa#1237
9/6/2021 14:34:18,x,270820,Harv,https://imgur.com/a/2F6ej21,Rocketeer,Portal 4TDM,,
9/6/2021 14:38:06,x,270820,Harv,https://imgur.com/a/2F6ej21,Rocketeer,Portal 4TDM,Secondary Record,
9/6/2021 15:15:47,x,270820,Harv,https://imgur.com/a/2F6ej21,Rocketeer,Portal 4TDM,,
9/6/2021 18:28:03,v,2633075,bird,https://imgur.com/a/1RuHsFV,Banshee,Squads-Duos,Highest Arras Scores,bird#1809
9/6/2021 18:44:23,v,3018455,Quad,https://i.imgur.com/c1VR5J2.png,Booster,FFA,Highest Arras Scores,
9/6/2021 22:19:39,v,3147072,Giggity,https://imgur.com/a/EPI7qLR,Fortress,4TDM,Highest Arras Scores,Giggity#8267
9/7/2021 0:47:02,v,3146772,ExC,https://imgur.com/a/4vaPkev,Smasher,4TDM,Highest Arras Scores,69th smasher HAS ever
9/7/2021 3:08:25,v,2206640,Raptor,https://imgur.com/a/TMZFaXk,Predator,Open Maze TDM,Highest Arras Scores,Fallen Wingston#5349
9/7/2021 5:13:36,v,1112369,Mine,https://imgur.com/a/LS123BW,Auto Spawner,Open Maze TDM,,
9/7/2021 6:38:07,v,3189277,bum,https://imgur.com/a/HHLmNsf,Ordnance,2TDM,Highest Arras Scores,
9/7/2021 7:40:42,v,2102701,Sonder,https://i.imgur.com/s8u6oeW.png,Penta Shot,FFA,Highest Arras Scores,
9/7/2021 11:41:35,x,1012349,PaNcAkE🥞,https://imgur.com/a/gXZkadM,Sniper,FFA,,
9/7/2021 12:17:42,x,1191026,[Mk9]   Xenom  SpX,https://imgur.com/a/c3FP830,Auto Spawner,2TDM,Secondary Record,XenomARRS#6741
9/7/2021 12:29:25,x,1191026,[Mk9]   Xenom  SpX,https://imgur.com/a/c3FP830,Auto Spawner,2TDM,Secondary Record,XenomARRS#6741
9/7/2021 15:34:17,v,3031130,Dr. Demise,https://imgur.com/a/tSymyPV,Surfer,FFA,Highest Arras Scores,Trouble#3298 - HAS only
9/7/2021 21:40:32,v,1120484,raphael,https://imgur.com/a/3zonJcN,Surfer,Maze 2TDM,,
9/7/2021 22:35:27,v,2340346,Mine,https://imgur.com/a/p4XVTXn,Auto 3,4TDM,Highest Arras Scores,
9/7/2021 23:17:26,v,3340259,jsohi,https://imgur.com/gallery/Wbg8SKF,Beekeeper,Portal 4TDM,Highest Arras Scores,solo 3m :sunglasses: (HAS + wr)
9/8/2021 3:03:52,v,1147950,Raptor,https://imgur.com/a/YlLHEbL,Bomber,Maze 2TDM,,Fallen Wingston#5349
9/8/2021 4:34:43,v,1866381,Mine,https://imgur.com/a/REzRDBz,Launcher,2TDM,,
9/8/2021 6:36:01,v,1307755,Mine,https://imgur.com/a/cn8ripz,Tri-Angle,Open Maze TDM,,
9/8/2021 9:15:24,v,1479501,⚡Balleя⚡,https://imgur.com/gallery/T0dQEC7,Ordnance,Maze 4TDM,Highest Arras Scores,WR Ordnance
9/8/2021 11:34:32,v,2490465,pool noodle,https://imgur.com/a/OoLPCUb,Launcher,2TDM,Highest Arras Scores,Samer Gamer #0101
9/8/2021 13:29:21,v,2646268,Sprunk,https://www.youtube.com/watch?v=8u_SOqFwo2g,Tri-Angle,4TDM,Highest Arras Scores,Sprunk#2002
9/9/2021 1:28:26,x,1038975,trò chơi đua xe vn,https://imgur.com/a/WDah9yk,Auto Smasher,Open TDM,Secondary Record,
9/9/2021 2:01:51,v,801926,Jessica <3,https://imgur.com/a/11ei790,Ordnance,Open TDM,,#ERROR!
9/9/2021 2:12:20,v,2137658,[The Ultimate],https://imgur.com/a/hB3smE5,Penta Shot,4TDM,Highest Arras Scores,[The Ultimate]#7041 I wanted to know if i can send scores that are greater than 2M to add the other scores that i already have
9/9/2021 5:49:50,v,5511556,Mine,https://imgur.com/a/NqgM6SU,Smasher,4TDM,Highest Arras Scores,
9/9/2021 8:30:37,v,2797438,Mine,https://imgur.com/a/3022HbF,Hybrid,4TDM,Highest Arras Scores,
9/9/2021 12:17:44,v,3088496,:Ö:,https://imgur.com/a/bx0jN7o,Landmine,4TDM,Highest Arras Scores,Ö 6m when
9/9/2021 12:26:21,v,5647610,:Ö:,https://imgur.com/a/xKSiDIm,Smasher,4TDM,Highest Arras Scores,and Ö submit scores when
9/9/2021 12:55:34,v,284440,Core,https://imgur.com/becN7tD,Landmine,FFA,Secondary Record,Core#9850 (secondary for longest ffa run and longest pacifist ffa run)
9/9/2021 13:44:08,v,2038459,Nox,https://imgur.com/gallery/k3KmxAQ,Banshee,2TDM,Highest Arras Scores,fun
9/9/2021 18:20:19,v,2506709,Corrupt Y,https://imgur.com/a/HUaGSzI,Conqueror,Maze 2TDM,Highest Arras Scores,
9/9/2021 18:22:21,v,1318513,amToast,https://imgur.com/a/FY5lDa6,Twister,Maze 2TDM,,imgur cause dc
9/9/2021 18:35:37,x,1108649,PaNcAkE🥞,https://imgur.com/a/XZkZinb,Falcon,4TDM,,
9/9/2021 20:17:15,v,2874518,1,https://imgur.com/953GLSO,Surfer,Open TDM,Highest Arras Scores,
9/9/2021 22:53:12,v,2201004,Rev,https://imgur.com/a/4t8zWSP,Falcon,2TDM,Highest Arras Scores,HAS only
9/10/2021 8:10:15,v,2347155,Rev,https://imgur.com/a/lT1m6gw,Rifle,4TDM,Highest Arras Scores,HAS only
9/10/2021 12:14:30,v,1527416,deepfreeze,https://imgur.com/a/ozQ2pJw,Commander,Open TDM,,drone in tdm is fun
9/10/2021 15:00:08,x,696969,⚡Balleя⚡,h,Auto Overseer,Squads-Duos,,
9/10/2021 15:05:59,x,696969,⚡Fat⚡,h,Auto Overseer,2TDM,,
9/10/2021 16:38:31,v,3009220,Awootube,https://imgur.com/a/ARAinoT,Auto Double,FFA,Highest Arras Scores,got 2v1 hunted since 1.5m and they still couldnt kill me L
9/10/2021 20:41:28,v,2098002,[The Ultimate],https://imgur.com/a/pj7MUrb,Fortress,4TDM,Highest Arras Scores,[The Ultimate]#7041
9/10/2021 23:47:21,v,1363315,69,https://imgur.com/a/6bgvY9X,Hunter,Maze 2TDM,,
9/10/2021 23:55:47,x,2097780,69,https://imgur.com/a/6WA0ciM,Mega Smasher,Open Maze TDM,Highest Arras Scores,already on has
9/11/2021 0:00:50,v,500318,69,https://imgur.com/a/Fa1NPT5,Rocketeer,4TDM,,
9/11/2021 0:57:39,x,1209740,edamameといふ人,https://youtu.be/9uYaSVdeG0c,Penta Shot,FFA,,I'm noob...
9/11/2021 9:53:07,v,566957,Raptor,https://imgur.com/a/VDjL50J,Tri-Angle,Maze 2TDM,,Fallen Wingston#5349
9/11/2021 10:46:07,v,3245447,Awootube,https://imgur.com/a/4merq3k,Bulwark,4TDM,Highest Arras Scores,el bruh
9/11/2021 21:08:20,x,2151273,Core From SYD,https://imgur.com/gallery/DevpZFo,Rocketeer,Squads-Duos,Highest Arras Scores,uhhhh. nice
9/11/2021 21:37:27,v,1345058,raphael,https://imgur.com/a/PpF8e7f,Tri-Angle,Portal 4TDM,,
9/12/2021 2:19:36,v,2985893,69,https://imgur.com/a/Bs4iYhR,Overdrive,2TDM,Highest Arras Scores,
9/12/2021 2:31:26,v,1141419,toy,https://imgur.com/a/0wcqYiD,Rocketeer,Maze,,-pastel#1605  (btw this was before the map expand)
9/12/2021 6:11:52,v,1272827,Nox,https://imgur.com/gallery/sJ5jrXC,Launcher,Open TDM,,fun
9/12/2021 10:27:39,v,784878,Reaper X,https://imgur.com/a/aqOXHVR,Auto Spawner,Maze 4TDM,,
9/12/2021 17:28:28,v,4896408,Mine,https://imgur.com/a/ONPZ5ox,Smasher,2TDM,Highest Arras Scores,
9/12/2021 17:32:33,v,2192008,Hestefisk,https://imgur.com/a/O5u4W9R,Hybrid,Maze,Highest Arras Scores,has
9/12/2021 17:42:54,v,1009403,amToast,https://imgur.com/a/LGogkbn,Bent Double,Maze 4TDM,,gg pm4tdm
9/13/2021 1:46:56,v,2089071,Raptor,https://imgur.com/a/BRrBv9B,Ordnance,Open TDM,Highest Arras Scores,i want to leave a message for wrms that i couldn't change the name of the imgur link to xwemtia nwova is pro
9/13/2021 2:51:31,v,1892556,殴るしかない顔面,https://imgur.com/a/4p0hVbH,Twister,FFA,,
9/13/2021 5:12:37,v,3037358,Thx m8,https://imgur.com/a/d6HYM9u,Hewn Double,Squads-Duos,Highest Arras Scores,HAS only. (Game mode was duos)
9/13/2021 5:34:12,v,1123057,69,https://imgur.com/a/ZcqXrcZ,Hunter,Open Maze TDM,,
9/13/2021 6:27:42,v,1464086,Rev,https://imgur.com/a/9ho1H81,Launcher,Squads-Duos,,
9/13/2021 10:07:55,v,1376943,Awootube,https://imgur.com/a/4JcnINi,Rocketeer,Squads-Duos,,"resubmit bc the record wasnt added back after the pre nerf score was removed, only really submitting bc this is the h"
9/13/2021 13:34:49,v,2308734,Sonder,https://i.imgur.com/Ggi4KCS.png,Smasher,2TDM,Highest Arras Scores,
9/13/2021 16:57:11,v,5749515,asd,https://imgur.com/a/t7Z08BS,Smasher,4TDM,Highest Arras Scores,not doing this again
9/14/2021 8:38:16,x,9230000,"69,5i,たばすこ,C-やま",https://imgur.com/a/oQCzUu8,~~Other~~,Portal 4TDM,Secondary Record,Biggest Rogue Celestlal (Tyr)(Celestlal) 9.23m. edamame#8632
9/14/2021 9:21:28,v,2804957,Mine,https://imgur.com/a/HZ2zGCo,Overdrive,2TDM,Highest Arras Scores,
9/14/2021 9:27:54,v,974478,Sky X,https://imgur.com/a/ksrfaqu,Ordnance,Open Maze TDM,,Silver Sky#0128
9/14/2021 9:28:51,v,2026131,Sonder,https://imgur.com/gallery/AGerLki,Swarmer,2TDM,Highest Arras Scores,
9/14/2021 13:42:17,v,2303487,Pawel99UK,https://imgur.com/a/GNGjjWI,Hexa Tank,FFA,Highest Arras Scores,lmao my first has submission in ages also weird build say gg >:(
9/14/2021 13:42:33,v,2429671,Smiley,https://imgur.com/a/r2mq0Ij,Smasher,4TDM,Highest Arras Scores,HAS only - restored at around 1.5mil
9/14/2021 14:29:26,v,4400321,⚡Balleя⚡,https://imgur.com/gallery/qQtbwMc,Overlord,Event (Legacy HAS only),Highest Arras Scores,Event has OP
9/14/2021 15:29:48,v,4306866,bum,https://imgur.com/a/xRUGLk4,Auto Smasher,4TDM,Highest Arras Scores,
9/14/2021 17:03:07,v,2063535,amToast,https://imgur.com/a/ieFbM21,Double Twin,Open Maze TDM,Highest Arras Scores,quad twin when
9/14/2021 22:22:36,v,2985085,toy,https://imgur.com/a/wjbYOBR,Ordnance,4TDM,Highest Arras Scores,-pastel#1605
9/15/2021 2:20:54,v,1535323,Hushed,https://imgur.com/a/Zsu6s9A,Rocketeer,Open Maze TDM,,Rocketeer world record
9/15/2021 2:44:09,v,2053378,Thx m8,https://imgur.com/a/lUWMRbJ,Annihilator,4TDM,Highest Arras Scores,HAS only.
9/15/2021 3:03:52,v,2074103,Rev,https://imgur.com/a/cKIZpuC,Bulwark,4TDM,Highest Arras Scores,HAS only
9/15/2021 3:08:47,v,3021297,Hushed,https://imgur.com/a/buIBEMk,Hybrid,Squads-Duos,Highest Arras Scores,Hushed#8185 (HAS only)
9/15/2021 8:48:20,v,1094802,duud,https://imgur.com/a/KkuFcan,Auto 3,Maze,,duudel#2946
9/15/2021 9:45:45,v,1111005,<❂> ₭ǿrɇa,https://imgur.com/gallery/bUcZgzu,Trapper,Maze 4TDM,,1k score...
9/15/2021 9:48:51,v,2213524,<❂> ₭ǿrɇa,https://imgur.com/gallery/stx92JG,Triple Shot,2TDM,Highest Arras Scores,
9/15/2021 9:51:19,v,3053081,<❂> ₭ǿrɇa,https://imgur.com/gallery/cyhi8cO,Booster,2TDM,Highest Arras Scores,
9/15/2021 9:54:46,v,2526310,<❂> ₭ǿrɇa,https://imgur.com/gallery/rfIJrR2,Smasher,2TDM,Highest Arras Scores,I love 2tdm.
9/15/2021 10:03:00,v,2731914,<❂> ₭ǿrɇa,https://imgur.com/gallery/PgXxQUj,Double Twin,4TDM,Highest Arras Scores,
9/15/2021 11:15:34,x,3320301,WL9,https://www.youtube.com/watch?v=iCJcV3flc9Q&feature=youtu.be,Beekeeper,FFA,Highest Arras Scores,https://discord.com/channels/808853082514522182/867876603370930236/887594802412154880
9/15/2021 12:31:08,v,4006342,bum,https://imgur.com/a/SkflJ3U,Minigun,2TDM,Highest Arras Scores,
9/15/2021 12:46:19,v,2641965,For Kenza 🌹,https://imgur.com/a/p26kX9o,Bushwhacker,2TDM,Highest Arras Scores,Alissa#1237
9/15/2021 13:05:02,v,6237598,Sonder,https://imgur.com/gallery/uVwTPD7,Penta Shot,FFA,Highest Arras Scores,I told you it would be mine.#6969
9/15/2021 13:25:59,v,2110802,⚡Balleя⚡,https://imgur.com/gallery/snCOLoY,Auto Overseer,4TDM,Highest Arras Scores,1er WR in 4TDM
9/15/2021 17:53:31,v,2014051,Quad,https://i.imgur.com/592eq3q.png,Fighter,FFA,Highest Arras Scores,
9/15/2021 18:52:20,v,2177983,Sexy Catto,https://imgur.com/a/J3p8PXM,Spike,4TDM,Highest Arras Scores,pls can my name be changed to Catto instead. 
9/15/2021 18:52:21,v,2176687,Awootube,https://imgur.com/a/2C9fq1Y,Spawner,4TDM,Highest Arras Scores,ram banshee prot go brrr
9/15/2021 19:28:59,x,3320301,WL9,https://imgur.com/a/QsVh6q1,Beekeeper,FFA,,"Not for has, already there"
9/15/2021 23:11:32,x,4329345,殴るしかない顔面,https://imgur.com/a/pbu4O96,Twister,FFA,Highest Arras Scores,
9/16/2021 1:28:33,v,4102382,Buddy_Dog,https://imgur.com/a/DjGSr2p,Auto Overseer,Portal 4TDM,Highest Arras Scores,Buddy_Dog#1441
9/16/2021 10:38:49,v,2046391,engineering,https://imgur.com/a/JylIcoW,Fighter,FFA,Highest Arras Scores,h score
9/16/2021 12:03:50,v,2484534,bum,https://imgur.com/a/QG5KUYk,Director,4TDM,Highest Arras Scores,has
9/16/2021 12:28:45,x,1866380,hewo,https://imgur.com/a/AECufVA,Skimmer,Maze,,"i forgot 1m ss, but took 1.65m ss and death ss cuz i got hunted by ols at 1.5m"
9/16/2021 15:27:24,x,1685688,eduardo,https://www.youtube.com/ https://prnt.sc/1sgwhkc,Launcher,Maze,Highest Arras Scores,eduardo
9/16/2021 16:08:19,v,1299014,Zekrom,https://imgur.com/a/AaNB2ik,Launcher,Open TDM,,Zekrom#0227
9/16/2021 22:09:48,v,556764,Sky X,https://imgur.com/a/6AOjG0s,Rocketeer,2TDM,,Silver Sky#0281
9/16/2021 23:14:29,v,2579351,Tetzyu ,https://imgur.com/a/OGwGjaO,Overdrive,FFA,Highest Arras Scores,Tetzyu#6356
9/17/2021 1:55:23,v,2208216,Gamer634,https://youtu.be/4E_z2RyEf4k,Auto Cruiser,2TDM,Highest Arras Scores,"Gamer634#5791 - If the link doesn't work, try in an hour or so, it's still processing currently; you probably won't see this until its done processing anyways."
9/17/2021 5:41:52,v,4190293,🥕Crazy Carrot🥕,https://imgur.com/a/BhLLl9l,Overlord,Portal 4TDM,Highest Arras Scores,🥕Crazy Carrot🥕#9982
9/17/2021 6:56:44,v,4166413,more,https://imgur.com/a/JA8LXBg,Auto Overseer,Open TDM,Highest Arras Scores,
9/17/2021 10:59:48,v,1611211,hewo,https://imgur.com/a/y926fim,Skimmer,Maze,,now accept my wr :c
9/17/2021 21:54:19,v,2308295,bird,https://imgur.com/a/7HHqpCd,Overdrive,2TDM,Highest Arras Scores,bird#1809 and i afk'd a lot so ratio yeah
9/18/2021 0:04:33,v,3207102,Cykattie,https://imgur.com/a/08ZiYtJ,Auto-Assassin,Open TDM,Highest Arras Scores,
9/18/2021 1:15:15,v,2177439,Darky,https://imgur.com/a/OAWossp,Predator,Open TDM,Highest Arras Scores,Just Dark?#8336
9/18/2021 2:43:09,x,1073272,69,https://imgur.com/a/UZaKV6t,Surfer,Open TDM,,time
9/18/2021 3:56:53,v,1747904,a letter a,https://imgur.com/a/5SFp0yE,Commander,Squads-Duos,,cancer server
9/18/2021 14:31:57,v,2030533,bird,https://imgur.com/a/wUnkOkT,Overdrive,4TDM,Highest Arras Scores,bird#1809
9/18/2021 15:28:35,v,601071,Awootube,https://imgur.com/a/qhbnI8w,Constructor,Squads-Duos,Secondary Record,highest score in 1 minute
9/18/2021 17:52:31,v,3366807,bird,https://imgur.com/gallery/pJnPnzX,Commander,Squads-Duos,Highest Arras Scores,bird#1809
9/18/2021 22:20:27,v,1349396,Tetzyu,https://imgur.com/a/aoWTSSl,Director,Maze,,Tetzyu#6356
9/19/2021 0:09:20,v,739131,raphael,https://imgur.com/a/FobKajS,Tri-Angle,Maze 2TDM,,
9/19/2021 5:16:43,v,2098922,4m,https://imgur.com/a/s4wz4C5,Overlord,Maze,Highest Arras Scores,carrot pro
9/19/2021 5:17:16,v,2217327,4m,https://imgur.com/a/QCrCOZb,Overlord,Maze,Highest Arras Scores,carrot pro
9/19/2021 5:17:55,v,2428637,4m,https://imgur.com/a/cbUs3id,Overlord,Maze,Highest Arras Scores,carrot pro
9/19/2021 11:28:16,v,2950890,Thing,https://imgur.com/a/0bIKn9L,Overlord,Event (Legacy HAS only),,woulda been second fastest 3m ever :((((
9/19/2021 12:19:05,v,2457494,our kill ,https://imgur.com/a/BEw78MB,Overlord,Maze,Highest Arras Scores,our kill#3016
9/19/2021 13:55:37,v,2170565,Smiley,https://imgur.com/a/6YYfgmi,Landmine,4TDM,Highest Arras Scores,HAS only
9/19/2021 18:16:03,v,2075484,Quad,https://i.imgur.com/ARqjJUy.png,Octo Tank,FFA,Highest Arras Scores,
9/19/2021 19:32:11,v,3300262,snip3rm4n,https://imgur.com/a/tivyzlO,Auto-Assassin,4TDM,Highest Arras Scores,ItzRemington#6201
9/19/2021 23:33:20,v,3153233,Pastel,https://imgur.com/a/VCZGiMl,Falcon,4TDM,Highest Arras Scores,-pastel#1605
9/20/2021 2:01:10,v,1036554,Spacebar,https://imgur.com/a/KlxUD8L,Sidewinder,Open Maze TDM,,Spacebar#7879 (307515377406181377)
9/20/2021 4:02:13,v,2134106,69,https://imgur.com/a/Y5r1XTJ,Overgunner,Maze,Highest Arras Scores,
9/20/2021 4:56:52,v,2114581,2114581,https://imgur.com/a/jhfGBFh,Fighter,FFA,Highest Arras Scores,HAS only.
9/20/2021 14:38:48,v,3076529,₮ⱤɄ₵ɆⱤ⚡️,https://imgur.com/a/SDWW0V7,Spawner,Event (Legacy HAS only),,Legacy HAS only
9/20/2021 19:37:33,v,3028788,Quad,https://i.imgur.com/WyM2Znn.png,Fighter,FFA,Highest Arras Scores,
9/21/2021 3:20:03,x,2134106,69,https://imgur.com/a/OV7qUg5,Overgunner,Maze,Highest Arras Scores,Change
9/21/2021 7:45:08,v,2045968,From Asia,https://imgur.com/a/KMYEKLG,Overlord,Squads-Duos,Highest Arras Scores,FromAsia#7568
9/21/2021 8:08:07,v,2644255,ASkib,https://imgur.com/a/m0UnvRa,Smasher,2TDM,Highest Arras Scores,
9/21/2021 8:12:51,v,2694439,Darky,https://imgur.com/a/rWnVt8v,Smasher,2TDM,Highest Arras Scores,Just Dark?#8336
9/21/2021 11:22:10,v,3676211,Darky,https://imgur.com/a/udZMWxf,Smasher,2TDM,Highest Arras Scores,Just Dark?#8336
9/21/2021 12:01:51,x,1348825,⚡Balleя⚡,https://imgur.com/gallery/1CYcO1G,Mega-3,Squads-Duos,Highest Arras Scores,xSBallerSx#6273
9/21/2021 12:27:40,x,2217327,4m,https://imgur.com/gallery/ZYN238U,Overlord,Maze,Highest Arras Scores,fuck yall ngl
9/21/2021 12:28:28,x,2098922,4m,https://imgur.com/gallery/ZYN238U,Overlord,Maze,Highest Arras Scores,and again
9/21/2021 12:29:27,x,2428637,4m,https://imgur.com/gallery/ZYN238U,Overlord,Maze,Highest Arras Scores,"and again thansk for the abuse ban :)) sry for beeing in servers..good reason the ban me, and if you ban l39 ban other huntes when????????"
9/21/2021 14:28:28,x,311269,Harv,https://imgur.com/a/jdiQV4R,Annihilator,Maze,,Category: Lowest Arras Scores
9/21/2021 14:30:36,x,311269,Harv,https://imgur.com/a/jdiQV4R,Annihilator,Maze,,Cat: Min/Max Scores
9/21/2021 15:38:16,x,1348825,⚡Balleя⚡,https://imgur.com/gallery/xpDvb0Z,Mega-3,Squads-Duos,Highest Arras Scores,xSBallerSx#6273
9/21/2021 16:00:17,x,1191026,[Mk9]   Xenom  SpX,https://i.imgur.com/acMB8ol.png,Auto Spawner,2TDM,,XenomARRS#6741
9/21/2021 18:13:53,v,8069080,// jAX,https://imgur.com/gallery/0u7WFtb,~~Other~~,FFA,,"Change my name back to  ""// jAX"" plz"
9/21/2021 22:27:40,v,5002974,Sonder,https://imgur.com/gallery/TaJbRCC,Auto-Assassin,Squads-Duos,Highest Arras Scores,
9/21/2021 22:28:06,v,1779171,Giggity,https://imgur.com/a/a4zu5EO,Fortress,Maze 2TDM,,Giggity#8267
9/22/2021 2:09:49,x,2134106,69,https://imgur.com/a/SfrLQJw,Overgunner,Maze,Highest Arras Scores,
9/22/2021 2:44:04,x,2134106,69,https://imgur.com/a/Q5bj2hO,Overgunner,Maze,Highest Arras Scores,why
9/22/2021 2:54:31,x,2134106,69,https://imgur.com/a/6tBgxBV,Overgunner,Maze,Highest Arras Scores,
9/22/2021 3:00:26,x,2134106,69,https://imgur.com/a/6tBgxBV,Overgunner,Maze,Highest Arras Scores,
9/22/2021 5:48:03,v,2036657,Thx m8,https://imgur.com/a/rzKZoni,Fighter,Squads-Duos,Highest Arras Scores,HAS + WR
9/22/2021 7:07:22,v,2011410,Awootube,https://imgur.com/a/dyi7kcM,Auto Overseer,Event (Legacy HAS only),,"Awootube#9041 - didnt rec the run so rip sub 30 tdm run, and bring back event wrs"
9/22/2021 7:46:36,v,2011762,Awootube,https://imgur.com/a/UpiizG1,Predator,Event (Legacy HAS only),,another 2nd place el bruh
9/22/2021 8:19:51,v,663631,Pastel,https://imgur.com/a/KFpt63w,Rocketeer,Maze 4TDM,,-melody#1605
9/22/2021 8:52:21,v,2901499,Darky,https://imgur.com/a/AOWpMyD,Landmine,Maze 4TDM,Highest Arras Scores,Just Dark?#8336
9/22/2021 11:22:25,v,3029712,Zeo'Xe,https://imgur.com/a/pdIdXYV,Auto-4,FFA,Highest Arras Scores,"a4 3.03m wr for FFA is not on has, im not actually zezo im just submitting for him to fix error."
9/22/2021 14:28:49,v,2007337,Sonder,https://imgur.com/gallery/p5iNYQL,Stalker,Squads-Duos,Highest Arras Scores,
9/22/2021 14:31:26,v,2416657,Thing,https://imgur.com/a/GjgRkVH,Battleship,Squads-Duos,Highest Arras Scores,
9/22/2021 14:47:22,x,1348825,⚡Balleя⚡,https://imgur.com/gallery/xpDvb0Z,Mega-3,Squads-Duos,Highest Arras Scores,
9/22/2021 20:28:04,v,3414738,Sonder,https://imgur.com/gallery/PPOjws8,Penta Shot,Squads-Duos,Highest Arras Scores,
9/23/2021 8:37:49,v,2097997,ASkib,https://imgur.com/a/RRozm1r,Fighter,Squads-Duos,Highest Arras Scores,ASkib#6828
9/23/2021 22:18:37,v,2538167,Pastel,https://imgur.com/a/g7vxN7y,Landmine,2TDM,Highest Arras Scores,-melody#1605
